raw_date,raw_title,raw_description,link
Publié le 12 avr. 2023,La STM testera des horaires illimités cet été,"Les Montréalais pourront dorénavant apporter leur vélo et promener leur chien dans le métro plus souvent, en vertu d’un nouveau projet pilote qui sera lancé ce samedi. Pendant trois mois cet été, entre mai et août, il n’y aura plus de restrictions quant aux horaires à respecter.",https://www.lapresse.ca/actualites/grand-montreal/2023-04-12/velos-et-chiens-dans-le-metro/la-stm-testera-des-horaires-illimites-cet-ete.php
Publié le 8 avr. 2023,L’achalandage repart à la hausse,"Après une accalmie hivernale, l’achalandage automobile repart ces jours-ci à la hausse sur les ponts Jacques-Cartier et Samuel-De Champlain, montrent de nouvelles données obtenues par . Dans les deux cas, on atteint des sommets pour le mois de mars depuis la fermeture partielle du pont-tunnel Louis-Hippolyte-La Fontaine.",https://www.lapresse.ca/actualites/circulation/2023-04-08/ponts-jacques-cartier-et-samuel-de-champlain/l-achalandage-repart-a-la-hausse.php
Publié le 3 avr. 2023,La station McGill maintenant universellement accessible,"La station McGill est officiellement devenue lundi « universellement accessible » avec la mise en place d’ascenseurs permettant l’accès au quai en direction de la station Angrignon. Dans tout le réseau du métro, elle est ainsi la 26 du genre sur un total de 68 stations.",https://www.lapresse.ca/actualites/grand-montreal/2023-04-03/metro/la-station-mcgill-maintenant-universellement-accessible.php
Publié le 28 mars 2023,La ligne verte partiellement paralysée,"La ligne verte du métro de Montréal est paralysée entre les stations Berri-UQAM et Honoré-Beaugrand, a indiqué mardi la Société de transports de Montréal (STM).",https://www.lapresse.ca/actualites/grand-montreal/2023-03-28/metro-de-montreal/la-ligne-verte-partiellement-paralysee.php
Publié le 28 mars 2023,Mort pour un vidéoclip ?,"Un vidéoclip teinté de provocations à peine voilées a mis le feu aux poudres parmi les gangs de Saint-Léonard et d’Anjou et pourrait avoir mené au meurtre de Khaled Mouloudj, 18 ans. Cet homicide survenu le 19 mars serait ancré dans un violent conflit qui aurait coûté la vie à au moins deux autres jeunes hommes dans les deux dernières années.",https://www.lapresse.ca/actualites/justice-et-faits-divers/2023-03-28/meurtre-d-un-jeune-de-18-ans-a-saint-leonard/mort-pour-un-videoclip.php
Publié le 24 mars 2023,Qui paiera pour les trains Azur à l’arrêt ?,"L’infolettre Le bulletin de circulation, envoyée tous les vendredis, présente les derniers développements en matière de transport (en tous genres) dans la grande région de Montréal et au Québec.",https://www.lapresse.ca/actualites/2023-03-24/metro-de-montreal/qui-paiera-pour-les-trains-azur-a-l-arret.php
Publié le 23 mars 2023,Une vingtaine de trains Azur à l’arrêt pour « usure prématurée »,"Une vingtaine des 71 trains Azur de la Société de transport de Montréal (STM) sont actuellement à l’arrêt en raison d’une « usure prématurée » du roulement des roues, a appris . Cette pause forcée ne nuit pas au service pour le moment, mais le transporteur ne peut assurer qu’aucun impact ne sera ressenti à plus long terme.",https://www.lapresse.ca/actualites/grand-montreal/2023-03-23/metro-de-montreal/une-vingtaine-de-trains-azur-a-l-arret-pour-usure-prematuree.php
Publié le 22 mars 2023,Des travaux préparatoires en vue au centre commercial Le Boulevard,"Des travaux préparatoires seront bientôt lancés au centre commercial Le Boulevard, eu vue du début des travaux du prolongement de la ligne bleue. La Société de transport de Montréal (STM) promet que l’établissement demeurera ouvert durant le chantier d’excavation de la future station, qui commencera dans quelques mois.",https://www.lapresse.ca/actualites/grand-montreal/2023-03-22/prolongement-de-la-ligne-bleue/des-travaux-preparatoires-en-vue-au-centre-commercial-le-boulevard.php
Publié le 21 mars 2023,Un homme violemment agressé dans le métro,"Une violente agression survenue lundi dans le métro fera l’objet d’une enquête policière. L’évènement, devenu viral en ligne, est « terrible », a affirmé mardi Valérie Plante au conseil municipal, tout en se faisant rassurante pour la sécurité des Montréalais.",https://www.lapresse.ca/actualites/grand-montreal/2023-03-21/un-homme-violemment-agresse-dans-le-metro.php
Publié le 20 mars 2023,"La STM poursuivie pour 6,3 millions en raison de nombreux retards","Une entreprise intente une poursuite de 6,3 millions contre la Société de transport de Montréal (STM), blâmant le transporteur et ses professionnels pour le retard de près de deux ans dans les travaux du nouveau centre de transport Crémazie, achevés en 2022.",https://www.lapresse.ca/actualites/grand-montreal/2023-03-20/chantier-du-complexe-cremazie/la-stm-poursuivie-pour-6-3-millions-en-raison-de-nombreux-retards.php
Publié le 12 mars 2023,À quoi ressemblera l’« ère REM » ?,"Vous lisez et entendez son nom depuis des années, mais dans quelques semaines, peut-être quelques mois, il deviendra réalité. Le Réseau express métropolitain (REM) prépare au printemps son grand lancement sur la Rive-Sud et promet de « transformer la mobilité » dans le Grand Montréal. À une condition : être aussi fiable que promis.",https://www.lapresse.ca/actualites/grand-montreal/2023-03-12/transport-collectif/a-quoi-ressemblera-l-ere-rem.php
Publié le 11 mars 2023,Les appels d’urgence ont plus que doublé depuis la pandémie,"Les constables spéciaux de la Société de transport de Montréal (STM) sont aux premières loges pour témoigner de la hausse de la criminalité dans les corridors souterrains de la métropole. Depuis deux ans, leurs effectifs ont diminué, tandis que le nombre des appels d’urgence, lui, a plus que doublé.",https://www.lapresse.ca/actualites/grand-montreal/2023-03-11/criminalite-dans-le-metro-de-montreal/les-appels-d-urgence-ont-plus-que-double-depuis-la-pandemie.php
Publié le 7 mars 2023,Le milieu des affaires appelle Québec à la prudence,"Le milieu des affaires s’oppose pour le moment à l’idée d’un « versement mobilité » basé sur la masse salariale des entreprises, évoquée par la ministre des Transports, Geneviève Guilbault. Dans l’Hexagone, la mesure finance déjà la moitié des dépenses d’Île-de-France Mobilités (IDFM) – l’équivalent parisien de l’Autorité régionale de transport métropolitain (ARTM).",https://www.lapresse.ca/affaires/2023-03-07/versement-mobilite-en-transport-collectif/le-milieu-des-affaires-appelle-quebec-a-la-prudence.php
Publié le 7 mars 2023,Geneviève Guilbault dans le métro,"La ministre récolte des idées pour diversifier le financement du transport collectif, comme une redevance sur la masse salariale des entreprises.",https://www.lapresse.ca/actualites/chroniques/2023-03-07/la-presse-a-paris/genevieve-guilbault-dans-le-metro.php
Publié le 6 mars 2023,Du gaz irritant force encore l’évacuation de plusieurs stations,"Un nouvel épisode de gaz irritant, le deuxième en un peu plus d’une semaine, a encore une fois forcé l’évacuation de plusieurs stations de métro sur la ligne orange lundi soir.",https://www.lapresse.ca/actualites/grand-montreal/2023-03-06/metro-de-montreal/du-gaz-irritant-force-encore-l-evacuation-de-plusieurs-stations.php
Publié le 3 mars 2023,L’usage de gaz irritant monte en flèche,"L’utilisation de vaporisateurs de poivre de Cayenne ou d’autres agents irritants dans le métro de Montréal a bondi depuis 2022, a appris . Un nouveau « phénomène urbain », selon la Société de transport de Montréal (STM), qui cause des maux de tête aux utilisateurs des transports en commun.",https://www.lapresse.ca/actualites/grand-montreal/2023-03-03/metro-de-montreal/l-usage-de-gaz-irritant-monte-en-fleche.php
Publié le 2 mars 2023,La SAAQ ne s’attendait pas à une crise « si importante »,"L’infolettre Le bulletin de circulation, envoyée tous les vendredis, présente les derniers développements en matière de transport (en tous genres) dans la grande région de Montréal et au Québec.",https://www.lapresse.ca/actualites/2023-03-02/transition-numerique/la-saaq-ne-s-attendait-pas-a-une-crise-si-importante.php
Publié le 2 mars 2023,L’ARTM veut livrer le service « comme une seule business »,"Mise en commun de ressources, service flexible, investissements ciblés : l’Autorité régionale de transport métropolitain (ARTM) exhorte les quatre opérateurs du Grand Montréal à penser comme « une seule business », pour économiser. Le milieu réserve toutefois un accueil en demi-teinte à cette feuille de route, insistant sur la nécessité de trouver des solutions permanentes à la crise du financement.",https://www.lapresse.ca/actualites/grand-montreal/2023-03-02/transport-collectif/l-artm-veut-livrer-le-service-comme-une-seule-business.php
Publié le 2 mars 2023,Le PQ veut que le budget Girard accorde une aide d’urgence,(Québec) Le Parti québécois (PQ) demande au gouvernement du Québec d’accorder une aide d’urgence au secteur du transport collectif pour que les sociétés publiques soient en mesure de maintenir l’offre de service partout au Québec.,https://www.lapresse.ca/actualites/politique/2023-03-02/transport-collectif/le-pq-veut-que-le-budget-girard-accorde-une-aide-d-urgence.php
Publié le 2 mars 2023,"40 % des aînés prendront davantage le métro et l’autobus, selon une étude","Environ quatre aînés sur dix utiliseront « davantage » les transports en commun dans la métropole une fois qu’ils seront gratuits pour les 65 ans et plus, selon une nouvelle étude de l’Université McGill. L’administration Plante, qui s’y est engagée à partir de juillet prochain, affirme que les problèmes financiers de la Société de transport de Montréal (STM) ne remettent pas en question sa décision.",https://www.lapresse.ca/actualites/grand-montreal/2023-03-02/gratuite-pour-les-65-ans-et-plus-a-la-stm/40-des-aines-prendront-davantage-le-metro-et-l-autobus-selon-une-etude.php
Publié le 1 mars 2023,Un énorme rebrassage s’annonce à Montréal,"On l’entend depuis des mois : il manquera 500 millions de dollars pour financer le transport collectif cette année dans le Grand Montréal, en raison de la baisse d’achalandage causée par la pandémie.",https://www.lapresse.ca/actualites/chroniques/2023-03-01/transport-collectif/un-enorme-rebrassage-s-annonce-a-montreal.php
Publié le 1 mars 2023,La liste des organisations tournant le dos à TikTok s’allonge,"La liste d’organisations tournant le dos à TikTok continue de s’allonger. Outre les universités, les cégeps et les centres de services scolaires qui devront appliquer les directives de Québec, plusieurs sociétés de transport ont déjà annoncé leur intention de bloquer l’utilisation du réseau social chinois pour leurs employés.",https://www.lapresse.ca/actualites/2023-03-01/transport-education-sante/la-liste-des-organisations-tournant-le-dos-a-tiktok-s-allonge.php
Publié le 28 févr. 2023,Des entreprises songent à se distancier de TikTok,"(Montréal) À l’instar des gouvernements, les entreprises devraient bien évaluer les risques avant de plonger dans l’univers de TikTok et prendre des précautions si elles s’y aventurent, croit un expert en cybersécurité. Certaines organisations québécoises disent avoir pris des dispositions face à l’application, telles que Desjardins et la Société de transport de Montréal (STM).",https://www.lapresse.ca/affaires/entreprises/2023-02-28/cybersecurite/des-entreprises-songent-a-se-distancier-de-tiktok.php
Publié le 28 févr. 2023,"Cessez de « prendre l’usager en otage », lance l’ARTM aux opérateurs","Dans une rare sortie du genre, mais surtout à quelques semaines du dévoilement du prochain budget du gouvernement Legault, l’Autorité régionale de transport métropolitain (ARTM) durcit le ton contre les sociétés de transport, exhortant celles-ci à cesser leurs « menaces » de réduction de service.",https://www.lapresse.ca/actualites/grand-montreal/2023-02-28/financement-du-transport-collectif/cessez-de-prendre-l-usager-en-otage-lance-l-artm-aux-operateurs.php
Publié le 27 févr. 2023,Une application pour visualiser les déviations en temps réel,Épuisé par les bus qui n’arrivent jamais dans la métropole ? Vous n’êtes pas seul. Un nouvel outil lancé ce lundi pourrait toutefois vous aider à y voir plus clair. La Société de transport de Montréal (STM) et l’organisme Transit ont créé une nouvelle technologie qui permettra de visualiser presque en temps réel les déviations des autobus et les parcours de remplacement.,https://www.lapresse.ca/actualites/grand-montreal/2023-02-27/autobus-de-la-stm/une-application-pour-visualiser-les-deviations-en-temps-reel.php
Publié le 26 févr. 2023,"Deux usagers s’aspergent de poivre de Cayenne, plusieurs stations de métro évacuées",Une altercation entre deux usagers du métro qui se sont mutuellement aspergés de poivre de Cayenne dans la station Atwater est à l’origine de l’évacuation de plusieurs stations de métro dimanche soir.,https://www.lapresse.ca/actualites/grand-montreal/2023-02-26/station-atwater/deux-usagers-s-aspergent-de-poivre-de-cayenne-plusieurs-stations-de-metro-evacuees.php
Publié le 25 févr. 2023,"Cinq stations, 14 000 logements et une nouvelle ville","Environ 14 000 nouveaux logements pouvant accueillir 28 000 personnes devraient sortir de terre autour du prolongement de la ligne bleue du métro de Montréal, selon une étude commandée par la Ville et obtenue par",https://www.lapresse.ca/actualites/grand-montreal/2023-02-25/prolongement-de-la-ligne-bleue/cinq-stations-14-000-logements-et-une-nouvelle-ville.php
Publié le 24 févr. 2023,Les embauches « ne suivent pas » le rythme d’expansion,"L’infolettre Le bulletin de circulation, envoyée tous les vendredis, présente les derniers développements en matière de transport (en tous genres) dans la grande région de Montréal et au Québec.",https://www.lapresse.ca/actualites/2023-02-24/entretien-des-vehicules-gouvernementaux/les-embauches-ne-suivent-pas-le-rythme-d-expansion.php
Publié le 23 févr. 2023,"Des experts inquiets, la mairesse rassurante","Experts, organismes et citoyens demeurent « sceptiques » quant à la qualité du service rendu dans le métro et les autobus à court terme, après la réduction des dépenses annoncée par la Société de transport de Montréal (STM). La mairesse Valérie Plante, elle, se range derrière l’opérateur et assure que la fréquence du service ne sera « absolument pas » touchée.",https://www.lapresse.ca/actualites/grand-montreal/2023-02-23/coupes-de-18-millions-a-la-stm/des-experts-inquiets-la-mairesse-rassurante.php
Publié le 22 févr. 2023,"Pas d’impact sur le service, assure Valérie Plante","Les coupes de 18 millions annoncées par la Société de transport de Montréal (STM) ne toucheront « absolument pas » à la qualité ou la fréquence du service rendu, assure la mairesse Valérie Plante. Elle réitère toutefois l’urgence de trouver une « solution à court terme » à la crise du financement en transport collectif.",https://www.lapresse.ca/actualites/grand-montreal/2023-02-22/coupes-de-18-millions-a-la-stm/pas-d-impact-sur-le-service-assure-valerie-plante.php
Publié le 21 févr. 2023,La STM réduira ses dépenses de 18 millions en 2023,"La Société de transport de Montréal (STM) se rend à l’évidence : devant un trou budgétaire de 78 millions, un « plan de réduction des dépenses non récurrentes » d’environ 18 millions doit être mis en place cette année. L’effort budgétaire permettra donc de ramener le manque à gagner autour de 60 millions.",https://www.lapresse.ca/actualites/grand-montreal/2023-02-21/trou-budgetaire/la-stm-reduira-ses-depenses-de-18-millions-en-2023.php
Publié le 20 févr. 2023,Au moins trois stations à nommer,"Les futures stations de la ligne bleue situées au coin des boulevards Viau, Pie-IX et Langelier ne devraient pas prendre ces noms, a indiqué lundi le grand patron de la Société de transport de Montréal (STM).",https://www.lapresse.ca/actualites/grand-montreal/2023-02-20/prolongement-de-la-ligne-bleue-du-metro/au-moins-trois-stations-a-nommer.php
Publié le 20 févr. 2023,Geneviève Guilbault n'abandonne pas le prolongement vers le centre-ville,"La ministre des Transports, Geneviève Guilbault, ouvre la porte à un éventuel prolongement du REM de l’Est vers le centre-ville, exclu du projet depuis le retrait de CDPQ Infra. Mais il se ferait dans une deuxième phase de travaux, soutient-elle, en rappelant qu’il faudra se pencher à nouveau sur le mode d’insertion et le tracé.",https://www.lapresse.ca/actualites/grand-montreal/2023-02-20/rem-de-l-est/genevieve-guilbault-n-abandonne-pas-le-prolongement-vers-le-centre-ville.php
Publié le 17 févr. 2023,"L’achalandage en hausse, surtout le week-end","L’infolettre Le bulletin de circulation, envoyée tous les vendredis, présente les derniers développements en matière de transport (en tous genres) dans la grande région de Montréal et au Québec.",https://www.lapresse.ca/actualites/grand-montreal/2023-02-17/metro-et-autobus-a-montreal/l-achalandage-en-hausse-surtout-le-week-end.php
Publié le 16 févr. 2023,Le manque de transport collectif inquiète un groupe pharmaceutique,"Un groupe pharmaceutique dénonce le manque d’offre en transport collectif dans le secteur industriel de Royalmount. Dans une démarche inusitée, l’entreprise, qui s’est inscrite au Registre des lobbyistes du Québec, demande à la Société de transport de Montréal (STM) d’améliorer son service pour permettre à ses travailleurs de se rendre au travail en toute sécurité.",https://www.lapresse.ca/actualites/grand-montreal/2023-02-16/quartier-royalmount/le-manque-de-transport-collectif-inquiete-un-groupe-pharmaceutique.php
Publié le 15 févr. 2023,Un homme crache au visage d’une femme après des propos racistes,La Société de transport de Montréal (STM) invite les usagers à dénoncer les comportements problématiques dans le métro à la suite de la diffusion d’une vidéo montrant un usager crachant sur une femme qui aurait prononcé le « mot commençant par N ».,https://www.lapresse.ca/actualites/justice-et-faits-divers/2023-02-15/metro-de-montreal/un-homme-crache-au-visage-d-une-femme-apres-des-propos-racistes.php
Publié le 15 févr. 2023,"Carabines, machettes et anxiété dans les transports publics",Une passagère poignardée à la tête dans un tramway. Deux employés du métro poursuivis par un homme armé d’une seringue. Un chauffeur victime d’un tir de carabine à air comprimé. Une jeune femme attaquée dans un bus en raison de sa race.,https://www.lapresse.ca/actualites/chroniques/2023-02-15/la-presse-a-toronto/carabines-machettes-et-anxiete-dans-les-transports-publics.php
Publié le 14 févr. 2023,Le transport collectif sur pause pour observer une minute de silence,"Les chauffeurs et employés de première ligne de plusieurs sociétés de transport cesseront leurs activités pendant une minute, mercredi à 8 h 24, heure précise à laquelle un chauffeur d’autobus a foncé sur une garderie du quartier Sainte-Rose, tuant deux enfants et en blessant six autres.",https://www.lapresse.ca/actualites/grand-montreal/2023-02-14/tragedie-de-laval/le-transport-collectif-sur-pause-pour-observer-une-minute-de-silence.php
Publié le 13 févr. 2023,Le meilleur de Montréal l’hiver : c’est maintenant que ça se passe,"Pour sa 24e édition, Montréal en Lumière en met plein la vue en proposant une expérience et une programmation améliorées. Du 16 février au 5 mars, le Quartier des spectacles devient la destination hivernale la plus courue en ville. Au resto, au cœur d’une salle de spectacle animée ou dehors au grand air, vivez le meilleur de Montréal l’hiver.",https://www.lapresse.ca/xtra/2023-02-13/montreal-en-lumiere/le-meilleur-de-montreal-l-hiver-c-est-maintenant-que-ca-se-passe.php
Publié le 10 févr. 2023,La STM sabre trois postes dans sa direction,"Devant un « contexte budgétaire difficile », la Société de transport de Montréal (STM) annonce une restructuration « organisationnelle » ayant pour effet de limoger trois directeurs exécutifs et de modifier le poste d’un autre. Ces changements permettront de « baisser de 8 % » la masse salariale du comité de direction.",https://www.lapresse.ca/actualites/grand-montreal/2023-02-10/contexte-budgetaire-difficile/la-stm-sabre-trois-postes-dans-sa-direction.php
Publié le 10 févr. 2023,"Dans l’Ouest, la crainte de surcharger le pont de l’Île-aux-Tourtes","L’infolettre Le bulletin de circulation, envoyée tous les vendredis, présente les derniers développements en matière de transport (en tous genres) dans la grande région de Montréal et au Québec.",https://www.lapresse.ca/actualites/grand-montreal/2023-02-10/arrivee-du-rem/dans-l-ouest-la-crainte-de-surcharger-le-pont-de-l-ile-aux-tourtes.php
Publié le 9 févr. 2023,L’opposition veut convoquer la STM en « conseil municipal spécial »,"L’opposition officielle à l’hôtel de ville réclame que les dirigeants de la Société de transport de Montréal (STM) soient convoqués à une séance extraordinaire du conseil municipal, pour s’expliquer sur « l’incertitude » autour du trou budgétaire de 77,8 millions et les potentielles réductions de service.",https://www.lapresse.ca/actualites/grand-montreal/2023-02-09/trou-budgetaire-de-78-millions/l-opposition-veut-convoquer-la-stm-en-conseil-municipal-special.php
Publié le 8 févr. 2023,Des chauffeurs dénoncent les usagers qui ne paient pas,"De plus en plus d’usagers du transport en commun de la métropole embarquent sans payer, dénoncent des chauffeurs et leur syndicat, réclamant une meilleure surveillance. La Société de transport de Montréal (STM), quant à elle, se dit en action, mais avoue ne pas pouvoir documenter entièrement le phénomène.",https://www.lapresse.ca/actualites/grand-montreal/2023-02-08/fraude-en-transport-collectif/des-chauffeurs-denoncent-les-usagers-qui-ne-paient-pas.php
Publié le 6 févr. 2023,Un plan pour « rationaliser » les dépenses d’ici la fin de 2023,"Québec veut « rationaliser » les dépenses en transport collectif et mettre sur pied un plan de financement sur cinq ans d’ici la fin de 2023. À la veille d’une « tournée de consultations » qu’elle souhaite entamer en mars pour « trouver des solutions » à la crise du financement dans l’industrie, la ministre des Transports, Geneviève Guilbault, prévient d’emblée que l’idée d’une nouvelle taxation semble peu probable.",https://www.lapresse.ca/actualites/2023-02-06/transport-collectif/un-plan-pour-rationaliser-les-depenses-d-ici-la-fin-de-2023.php
Publié le 4 févr. 2023,Vague de mobilisation pour faire face au froid extrême,(Montréal) Les services aux plus vulnérables ont fait des pieds et des mains pour s’assurer que tous soient au chaud alors que la vague de froid se poursuivait au Québec samedi.,https://www.lapresse.ca/actualites/2023-02-04/vague-de-mobilisation-pour-faire-face-au-froid-extreme.php
Publié le 3 févr. 2023,Le Québec atteint un record de demande d’électricité ,Des milliers d’automobilistes ont dû demander les services de CAA Québec dans la seule journée de vendredi en raison du froid.,https://www.lapresse.ca/actualites/2023-02-03/froid-extreme/le-quebec-atteint-un-record-de-demande-d-electricite.php
Publié le 3 févr. 2023,Québec pressé d’augmenter l’offre d’au moins 5 % par année,"L’infolettre Le bulletin de circulation, envoyée tous les vendredis, présente les derniers développements au sujet des principales entraves routières dans la grande région de Montréal",https://www.lapresse.ca/actualites/2023-02-03/transport-collectif/quebec-presse-d-augmenter-l-offre-d-au-moins-5-par-annee.php
Publié le 2 févr. 2023,"Vague de froid, vague d’inquiétude","Les prochains jours s’annoncent froids, très froids. Alors que les refuges pour sans-abri débordent à Montréal, les intervenants appréhendent un défi de taille pour garder tout le monde au chaud. Et il n’y a pas que dans la métropole que des craintes sont exprimées : des municipalités d’un peu partout dans la province demandent à Québec de mieux les épauler dans la lutte contre l’itinérance.",https://www.lapresse.ca/actualites/2023-02-02/refuges-pour-sans-abri/vague-de-froid-vague-d-inquietude.php
Publié le 1 févr. 2023,Prochaine station : ambition,Les titres de ces pages font plaisir à lire : « Doubler l’offre de transport collectif » et « Construisez un TGV ». Ces énoncés redonnent espoir d’autant plus que la pandémie a porté un coup dur au transport collectif.,https://www.lapresse.ca/debats/opinions/2023-02-01/transport-collectif/prochaine-station-ambition.php
Publié le 1 févr. 2023,"Plante planche sur des solutions, mais demande l’aide de Québec","Il faudra accélérer la revitalisation de la portion est du centre-ville autour de la station Berri-UQAM, dont l’image est devenue « triste », avoue la mairesse de Montréal, Valérie Plante. Promettant plusieurs solutions concrètes dans les prochains mois, l’élue implore toutefois le gouvernement Legault de lui donner des ressources supplémentaires pour « réduire la pression ».",https://www.lapresse.ca/actualites/grand-montreal/2023-02-01/secteur-berri-uqam/plante-planche-sur-des-solutions-mais-demande-l-aide-de-quebec.php
