raw_date,raw_title,raw_description,link
Publié le 23 juin 2021,Un retour dans les tours pour relancer le centre-ville,"La campagne de vaccination va bon train, au-delà des espérances initiales de bien des observateurs avertis, si bien que Montréal est rapidement passée en zone jaune et se retrouvera bientôt en zone verte. C’est une étape majeure dans la reprise des activités qui permettra de redynamiser le centre-ville et d’y ramener son énergie d’avant. C’est également le signal que de nombreuses entreprises attendaient pour planifier le retour progressif de leurs employés dans leurs bureaux. Cela dit, les défis qui nous attendent sont nombreux.",https://www.lapresse.ca/debats/opinions/2021-06-23/un-retour-dans-les-tours-pour-relancer-le-centre-ville.php
Publié le 18 juin 2021,« J’ai couru ma vie »,"Avec la crise sanitaire, les voitures du métro de Montréal se sont vidées et plusieurs sièges d’autobus demeurent inoccupés. Malgré tout, les attouchements, le voyeurisme et l’exhibitionnisme dans les transports collectifs n’ont pratiquement pas diminué en 2020. Et l’année 2021 s’annonce pire que celle avant la pandémie, révèlent des chiffres obtenus par .",https://www.lapresse.ca/actualites/2021-06-18/crimes-sexuels-dans-les-transports-collectifs/j-ai-couru-ma-vie.php
Publié le 10 juin 2021,Fin du port du masque pour les chauffeurs d'autobus de la STM,"Dès le 14 juin, les chauffeurs d’autobus de la Société de transport de Montréal (STM) n’auront plus besoin de porter le masque de procédure lorsqu’ils sont au volant, a annoncé la STM jeudi.",https://www.lapresse.ca/actualites/covid-19/2021-06-10/fin-du-port-du-masque-pour-les-chauffeurs-d-autobus-de-la-stm.php
Publié le 9 juin 2021,Des familles évacuées après un incendie dans un puits souterrain,"Une douzaine de familles ont été évacuées de leur domicile de manière préventive, mercredi soir sur le Plateau-Mont-Royal, après qu’un feu se soit déclaré dans un puits souterrain. Des agents d’Hydro-Québec ont été appelés sur place et l’électricité a été interrompue.",https://www.lapresse.ca/actualites/justice-et-faits-divers/2021-06-09/plateau-mont-royal/des-familles-evacuees-apres-un-incendie-dans-un-puits-souterrain.php
Publié le 9 juin 2021,Un tunnel piétonnier pour relier le SRB Pie-IX et le prolongement de la ligne bleue,"Le projet intégré de service rapide par bus (SRB) Pie-IX va bon train ! Les travaux de cet ensemble d’infrastructures de transport collectif se poursuivent, notamment à l’intersection du boulevard Pie-IX et de la rue Jean-Talon avec la construction d’un tunnel piétonnier sous les abris SRB. Ces travaux permettront de relier le SRB Pie-IX et la future station de métro du prolongement de la ligne bleue, créant ainsi une station intermodale.",https://www.lapresse.ca/xtra/2021-06-09/srb-pie-ix/un-tunnel-pietonnier-pour-relier-le-srb-pie-ix-et-le-prolongement-de-la-ligne-bleue.php
Publié le 7 juin 2021,Un (trop) petit pas dans la bonne direction,"Il y a quelques semaines, l’Autorité régionale du transport métropolitain (ARTM) présentait sa nouvelle grille tarifaire. Selon cette nouvelle grille, les aînés bénéficieront d’un rabais de 70 % sur les services de la Société de transport de Montréal (STM). Les enfants de 11 ans et moins voyageront gratuitement. Des décisions que la mairesse de Montréal, Valérie Plante, a considérées comme une « première étape dans la bonne direction » concernant des « mesures de tarifications plus équitables. » De quelle équité parle-t-on ici ?",https://www.lapresse.ca/debats/opinions/2021-06-07/nouvelle-grille-tarifaire-en-transport-en-commun/un-trop-petit-pas-dans-la-bonne-direction.php
Publié le 29 mai 2021,"Incendie criminel dans un commerce, plusieurs logements évacués","Une enquête a été ouverte samedi par la police de Montréal en lien avec un incendie possiblement criminel qui est survenu dans la nuit de vendredi à samedi, dans un commerce de Saint-Léonard. Des logements adjacents ont dû être évacués.",https://www.lapresse.ca/actualites/justice-et-faits-divers/2021-05-29/saint-leonard/incendie-criminel-dans-un-commerce-plusieurs-logements-evacues.php
Publié le 25 mai 2021,"Après un an d’absence, les camelots de retour dans le métro","Après plus d’un an d’absence, les camelots de L’Itinéraire sont de retour dans le métro de Montréal. Dès mardi, un projet-pilote permettra à sept d’entre eux de retrouver leur poste dans des stations ciblées, selon un protocole sanitaire strict. La Société de transport de Montréal (STM) n’exclut pas d’élargir le projet si tout se passe bien.",https://www.lapresse.ca/actualites/grand-montreal/2021-05-25/l-itineraire/apres-un-an-d-absence-les-camelots-de-retour-dans-le-metro.php
Publié le 24 mai 2021,Un dialogue à entretenir,"Le meurtre de George Floyd, survenu il y a un an, a ouvert les yeux du monde entier aux vécus noirs. De multiples voix s’élèvent désormais sans gêne pour dénoncer le racisme. Mais il en faudra plus pour espérer un réel changement, confient des femmes noires actives dans leur milieu. Nous avons parlé à quatre d’entre elles.",https://www.lapresse.ca/societe/2021-05-24/un-an-apres-george-floyd/un-dialogue-a-entretenir.php
Publié le 14 mai 2021,Sauver la tortue bleue,Quarante-deux ans. Voilà depuis combien de temps Montréal désire prolonger la ligne bleue du métro. Ce sont trois générations de citoyens du nord-est de Montréal à qui l’on parle de ce projet depuis qu’ils sont au berceau. Un projet qui avance à pas de tortue.,https://www.lapresse.ca/debats/editoriaux/2021-05-14/sauver-la-tortue-bleue.php
Publié le 13 mai 2021,Les dés sont pipés,"Le projet du REM est éminemment critiquable. Nous avons rédigé divers documents sur le sujet, dont la position du Collectif en environnement Mercier-Est (CEM-E), dénonçant les impacts majeurs que le mastodonte aérien projeté par CDPQ Infra fera subir aux citoyens des quartiers traversés, en mettant l’accent sur ses effets délétères dans la rue Sherbrooke, sur ses abords et même dans le reste du quartier.",https://www.lapresse.ca/debats/opinions/2021-05-13/consultation-sur-le-rem-de-l-est/les-des-sont-pipes.php
Publié le 13 mai 2021,La fermeture du centre commercial Le Boulevard déplorée,"Des résidants de Rosemont sont préoccupés par l’acquisition – et la fermeture – du centre commercial Le Boulevard par la STM pour réaliser le prolongement de la ligne bleue. Il s’agit d’une « catastrophe annoncée » pour ces citoyens, qui anticipent une réduction considérable de leurs services de proximité.",https://www.lapresse.ca/affaires/2021-05-13/rosemont/la-fermeture-du-centre-commercial-le-boulevard-deploree.php
Publié le 12 mai 2021,Valérie Plante s’oppose au retrait d’une station,"Valérie Plante refuse catégoriquement d’envisager l’abolition d’une des cinq stations du prolongement de la ligne bleue du métro, un scénario évoqué par la ministre déléguée aux Transports en entrevue à plus tôt cette semaine.",https://www.lapresse.ca/actualites/grand-montreal/2021-05-12/ligne-bleue-du-metro/valerie-plante-s-oppose-au-retrait-d-une-station.php
Publié le 11 mai 2021,L’élimination d’une station est sur la table,"La STM recommande de réduire « au minimum » les activités du bureau de projet de la ligne bleue tant que le flou entourant l’avenir du dossier n’aura pas été dissipé, a appris . La ministre déléguée aux Transports assure de son côté que le prolongement ira de l’avant, mais qu’une des cinq stations pourrait être éliminée.",https://www.lapresse.ca/affaires/2021-05-11/prolongement-de-la-ligne-bleue/l-elimination-d-une-station-est-sur-la-table.php
Publié le 11 mai 2021,Le MTQ forcé de payer 115 millions pour un centre commercial,"L’expropriation d’un vieux centre commercial pour le prolongement de la ligne bleue n’est pas de tout repos. Le gouvernement prévoyait s’emparer du tiers du terrain, mais il a dû le prendre au complet pour 115 millions, un coût quatre fois plus élevé que prévu. Son propriétaire s’est même adressé directement au premier ministre dans un restaurant pour se plaindre de « la bureaucratie du ministère des Transports ».",https://www.lapresse.ca/affaires/2021-05-11/prolongement-de-la-ligne-bleue/le-mtq-force-de-payer-115-millions-pour-un-centre-commercial.php
Publié le 10 mai 2021,"Le coût des expropriations quadruple à 1,2 milliard","La facture prévue pour les expropriations le long du tracé de la future ligne bleue a presque quadruplé depuis 2018, à plus de 1,2 milliard, révèlent de nouveaux documents confidentiels obtenus par . La STM déplore n’avoir « aucun contrôle » sur cette explosion des coûts.",https://www.lapresse.ca/affaires/2021-05-10/ligne-bleue/le-cout-des-expropriations-quadruple-a-1-2-milliard.php
Publié le 10 mai 2021,Y a-t-il un pilote dans le métro ?,"Chaque mois de retard dans le prolongement de la ligne bleue fait gonfler la facture de 15 millions de dollars, a appris , sans aucune valeur ajoutée au projet. Et les délais s’accumulent. Tout comme la confusion. La structure de gouvernance actuelle, écartelée entre 14 comités, est jugée « déficiente », révèlent des documents confidentiels que nous avons obtenus. Incursion dans un labyrinthe bureaucratique.",https://www.lapresse.ca/affaires/2021-05-10/prolongement-de-la-ligne-bleue/y-a-t-il-un-pilote-dans-le-metro.php
Publié le 1 mai 2021,Les prévisions de fréquentation du REM ne changent pas,"La fréquentation des transports en commun demeure en berne au Québec et notamment à Montréal, avec des millions perdus pour les opérateurs, mais le Réseau express métropolitain (REM) compte toujours remplir ses rames.",https://www.lapresse.ca/actualites/grand-montreal/2021-05-01/hausse-du-teletravail/les-previsions-de-frequentation-du-rem-ne-changent-pas.php
Publié le 29 avr. 2021,"Gratuit jusqu’à 11 ans, forte baisse pour les aînés","L’harmonisation des tarifs du transport en commun profitera de façon importante aux enfants et aux aînés montréalais, vient d’annoncer l’Autorité régionale de transport métropolitain (ARTM).",https://www.lapresse.ca/actualites/grand-montreal/2021-04-29/tarifs-du-transport-en-commun/gratuit-jusqu-a-11-ans-forte-baisse-pour-les-aines.php
Publié le 29 avr. 2021,Partie de Monopoly entre géants de l’immobilier,"La Caisse de dépôt et Cadillac Fairview s’échangent le centre Fairview Pointe-Claire et les Galeries d’Anjou, a appris La Presse",https://www.lapresse.ca/affaires/2021-04-29/centres-commerciaux/partie-de-monopoly-entre-geants-de-l-immobilier.php
Publié le 25 avr. 2021,Des manifestants dénoncent « une action inutile et brutale »,"Choqués par la récente intervention musclée d’inspecteurs de la STM auprès d’une femme trans et noire dans le métro de Montréal, une cinquantaine de citoyens se sont rassemblés au parc Jarry pour dénoncer « une action inutile et brutale ».",https://www.lapresse.ca/actualites/grand-montreal/2021-04-25/arrestation-musclee-dans-le-metro/des-manifestants-denoncent-une-action-inutile-et-brutale.php
Publié le 21 avr. 2021,La STM fait appel à un expert en déontologie,"Les inspecteurs de la Société de transport de Montréal (STM) qui ont effectué une arrestation musclée dans le métro samedi dernier ont suivi toutes les règles d’emploi de la force, selon les conclusions préliminaires d’une enquête interne, mais un expert indépendant en déontologie se penchera sur ces conclusions, pour « répondre aux préoccupations exprimées par le public ».",https://www.lapresse.ca/actualites/justice-et-faits-divers/2021-04-21/arrestation-musclee-dans-le-metro/la-stm-fait-appel-a-un-expert-en-deontologie.php
Publié le 21 avr. 2021,Québec lance quatre nouveaux projets pilotes,(Québec) Le gouvernement Legault lance quatre nouveaux projets pilotes avec la Sûreté du Québec (SQ) pour tester l’utilisation de caméras corporelles par les policiers.,https://www.lapresse.ca/actualites/politique/2021-04-21/cameras-corporelles-sur-les-policiers/quebec-lance-quatre-nouveaux-projets-pilotes.php
Publié le 21 avr. 2021,Pas de vote postal massif à Montréal,"À moins d’un revirement, Montréal ne tiendra pas d’opération à grande échelle de vote par correspondance lors du scrutin municipal de novembre prochain.",https://www.lapresse.ca/actualites/grand-montreal/2021-04-21/elections-municipales/pas-de-vote-postal-massif-a-montreal.php
Publié le 20 avr. 2021,Valérie Plante évoque une enquête indépendante,La mairesse de Montréal a ouvert la porte à la tenue d’une enquête indépendante sur une intervention des inspecteurs du métro qui a soulevé un tollé en fin de semaine dernière.,https://www.lapresse.ca/actualites/grand-montreal/2021-04-20/intervention-musclee-au-metro-jean-talon/valerie-plante-evoque-une-enquete-independante.php
Publié le 19 avr. 2021,Enquête sur une arrestation musclée dans le métro,"La Société de transport de Montréal (STM) a ouvert une enquête interne au sujet d’une arrestation musclée ayant eu lieu dans le métro samedi, qui a été filmée par des usagers.",https://www.lapresse.ca/actualites/justice-et-faits-divers/2021-04-19/montreal/enquete-sur-une-arrestation-musclee-dans-le-metro.php
Publié le 16 avr. 2021,« On attend et on perd du temps »,"Faut-il ouvrir la vaccination sans rendez-vous à plus de Québécois ? Devant une campagne de vaccination avec les doses d’AstraZeneca qui ralentit dans le Grand Montréal, des experts et des médecins appellent les autorités à se prononcer rapidement. Déjà, la Santé publique envisage la possibilité d’offrir ce vaccin « à d’autres catégories d’âge ».",https://www.lapresse.ca/actualites/covid-19/2021-04-16/vaccination-au-ralenti-a-montreal/on-attend-et-on-perd-du-temps.php
Publié le 15 avr. 2021,Un trou de 5 milliards dans le budget,"Notre récent reportage sur les catacombes du métro qui se désagrègent a fait réagir. Et il m’a permis de découvrir l’existence d’un trou de 5,5 milliards de dollars dans le récent budget des infrastructures du gouvernement du Québec.",https://www.lapresse.ca/affaires/economie/2021-04-15/renovation-du-metro/un-trou-de-5-milliards-dans-le-budget.php
Publié le 13 avr. 2021,"Inquiet des hausses de coûts, Québec crée un nouveau « groupe d’action »",Le gouvernement Legault en a assez de l’augmentation « pas acceptable » des coûts liés au prolongement de la ligne bleue à Montréal. Québec crée un groupe d’action qui aura pour mandat de déterminer — d’ici trois mois — la meilleure stratégie pour réaliser le projet dans les temps et en respectant le budget.,https://www.lapresse.ca/actualites/grand-montreal/2021-04-13/ligne-bleue/inquiet-des-hausses-de-couts-quebec-cree-un-nouveau-groupe-d-action.php
Publié le 9 avr. 2021,"Les catacombes, un autre projet de 3,9 milliards","À peine arrivée à la station McGill, l’équipe de la Société de transport de Montréal (STM) nous montre l’eau qui coule en abondance du plafond, près de la sortie des Promenades de la cathédrale.",https://www.lapresse.ca/affaires/2021-04-09/transports-collectifs/les-catacombes-un-autre-projet-de-3-9-milliards.php
Publié le 8 avr. 2021,Le suspect arrêté,L’homme soupçonné d’avoir proféré des menaces de mort et d’avoir harcelé une jeune Québécoise d’origine asiatique dans le métro de Montréal a été arrêté samedi par le Service de police de la Ville de Montréal (SPVM).,https://www.lapresse.ca/actualites/2021-04-08/propos-racistes-dans-le-metro/le-suspect-arrete.php
Publié le 25 mars 2021,Les inspecteurs de la STM deviendront des « constables spéciaux »,"À partir de juillet, les inspecteurs de la Société de transport de Montréal (STM) accéderont au statut de « constable spécial », ce qui leur conférera plus de pouvoirs pour intervenir.",https://www.lapresse.ca/actualites/grand-montreal/2021-03-25/les-inspecteurs-de-la-stm-deviendront-des-constables-speciaux.php
Publié le 22 mars 2021,Un garçon de 17 ans poignardé est dans un état critique,Un garçon de 17 ans a été poignardé en début d’après-midi lundi dans le quartier Saint-Michel. Il est dans un état critique.,https://www.lapresse.ca/actualites/justice-et-faits-divers/2021-03-22/un-garcon-de-17-ans-poignarde-est-dans-un-etat-critique.php
Publié le 15 mars 2021,« Le métro est à tout le monde »,"Le nombre de sans-abri a doublé à Montréal depuis un an, indiquait la mairesse Valérie Plante en septembre dernier. Dans le métro, ils sont plus visibles que jamais. Comment venir en aide à ces gens vulnérables, souvent pris en souricière entre des problèmes de santé mentale et de consommation ? Depuis novembre, une nouvelle (et petite) équipe d’intervenants espère faire école avec une approche tout en douceur.",https://www.lapresse.ca/actualites/grand-montreal/2021-03-15/itinerance-a-montreal/le-metro-est-a-tout-le-monde.php
Publié le 13 mars 2021,Des milliers de personnes manifestent contre les mesures sanitaires,(Montréal) Dix personnes ont été arrêtées et les policiers ont distribué 144 constats d’infraction lors d’une manifestation contre les mesures sanitaires samedi à Montréal.,https://www.lapresse.ca/actualites/2021-03-13/montreal/des-milliers-de-personnes-manifestent-contre-les-mesures-sanitaires.php
Publié le 27 févr. 2021,La vie nocturne à l’heure du couvre-feu,"Malgré le couvre-feu et les mesures sanitaires, il y a encore un peu de vie la nuit à Montréal. Nous sommes allés à la rencontre de ceux qui travaillent pendant que la ville dort. Portraits.",https://www.lapresse.ca/societe/sante/2021-02-27/un-an-de-pandemie/la-vie-nocturne-a-l-heure-du-couvre-feu.php
Publié le 22 févr. 2021,Métro débarquait dans le métro il y a 20 ans,"Le 1er mars 2001, le journal Métro voyait le jour. L’annonce de son arrivée dans le métro de Montréal a engendré beaucoup de questionnement, plusieurs craintes, et stimulé rapidement le lancement d’un concurrent par Québecor. Deux décennies plus tard, où en est-on avec la lecture des quotidiens gratuits ?",https://www.lapresse.ca/affaires/medias/2021-02-22/metro-debarquait-dans-le-metro-il-y-a-20-ans.php
Publié le 18 févr. 2021,Le centre-ville de Montréal toujours dans un état critique,"Il y a trois mois, on comparait le centre-ville à un malade aux soins intensifs. Depuis, on observe quelques faibles signes d’amélioration, mais son état demeure critique.",https://www.lapresse.ca/affaires/economie/2021-02-18/le-centre-ville-de-montreal-toujours-dans-un-etat-critique.php
Publié le 17 févr. 2021,Des bancs utilisés par des sans-abri condamnés par la STM,"Au plus froid de l’hiver, la Société de transport de Montréal (STM) vient de physiquement condamner des bancs qui servaient de lieu de rassemblement aux sans-abri dans le métro de Montréal.",https://www.lapresse.ca/actualites/grand-montreal/2021-02-17/metro-bonaventure/des-bancs-utilises-par-des-sans-abri-condamnes-par-la-stm.php
Publié le 16 févr. 2021,Plusieurs écoles du Québec fermées,"Les abondantes chutes de neige ont contraint plusieurs écoles à travers la province à fermer leurs portes pour la journée. La tempête qui s'est entamée lundi soir se poursuivra tout au long de la journée de mardi, avec des quantités de neige pouvant atteindre une trentaine de centimètres dans certains secteurs.",https://www.lapresse.ca/actualites/education/2021-02-16/tempete-de-neige/plusieurs-ecoles-du-quebec-fermees.php
Publié le 12 févr. 2021,Préparer maintenant la réouverture progressive des bureaux,"Sur fond de pandémie, les autorités publiques ont avec raison fermé en 2020 le centre-ville. Avec les résultats que l’on connaît.",https://www.lapresse.ca/debats/opinions/2021-02-12/centre-ville-de-montreal/preparer-maintenant-la-reouverture-progressive-des-bureaux.php
Publié le 11 févr. 2021,"La victime a succombé à ses blessures, le suspect arrêté",L’homme qui avait été retrouvé gravement blessé jeudi matin dans un immeuble à logements de Montréal-Nord a succombé à ses blessures. Un suspect a été arrêté.,https://www.lapresse.ca/actualites/justice-et-faits-divers/2021-02-11/operation-policiere-a-montreal-nord/la-victime-a-succombe-a-ses-blessures-le-suspect-arrete.php
Publié le 30 janv. 2021,"Moins d’asphalte, plus de rendement","Une nouvelle vocation attend les vastes stationnements qui entourent les centres commerciaux. Pour maximiser la valeur de ces actifs en asphalte, leurs propriétaires envisagent d’y construire des tours d’habitation. vous présente 10 projets en cours.",https://www.lapresse.ca/affaires/entreprises/2021-01-30/centres-commerciaux/moins-d-asphalte-plus-de-rendement.php
Publié le 21 janv. 2021,Le service reprend sur la ligne orange du métro,Le service reprend graduellement dans le métro de Montréal après une infiltration d’eau qui a paralysé la ligne orange entre les stations Lionel-Groulx et Henri-Bourassa jeudi matin.,https://www.lapresse.ca/actualites/grand-montreal/2021-01-21/infiltration-d-eau/le-service-reprend-sur-la-ligne-orange-du-metro.php
Publié le 12 janv. 2021,Une femme enceinte impliquée dans une collision avec un véhicule de la STM,"Un véhicule de la Société de transport de Montréal (STM) est entré mardi soir en collision avec une autre automobile, avec à son bord une femme de 33 ans qui est enceinte. Celle-ci a été transportée en centre hospitalier pour y subir des tests médicaux, mais on ne déplore toutefois aucun blessé majeur.",https://www.lapresse.ca/actualites/justice-et-faits-divers/2021-01-12/saint-leonard/une-femme-enceinte-impliquee-dans-une-collision-avec-un-vehicule-de-la-stm.php
Publié le 3 janv. 2021,Où sont passés les musiciens du métro ?,"Depuis le début de la pandémie, les temps sont difficiles pour les musiciens du métro et les artistes de la rue à Montréal. Privés de leurs plus grandes scènes, plusieurs d’entre eux songent désormais à changer de profession.",https://www.lapresse.ca/arts/musique/2021-01-03/ou-sont-passes-les-musiciens-du-metro.php
Publié le 30 déc. 2020,Métro de Montréal : reprise graduelle du service,"(Montréal) La Société de transport de Montréal (STM) a annoncé vers 9 h 45, mercredi, une reprise graduelle du service de métro sur la ligne verte.",https://www.lapresse.ca/actualites/grand-montreal/2020-12-30/metro-de-montreal-reprise-graduelle-du-service.php
Publié le 26 déc. 2020,À fond dans le ski !,"Des amateurs de plein air n’ont pas hésité à faire la queue ces derniers temps pour mettre la main sur des skis de fond. Clubs, commerçants et adeptes sont tous du même avis : le sport n’a jamais été si populaire. Voici quelques conseils pour se lancer sans se casser le coccyx ni, pandémie oblige, avoir à s’éloigner trop de la maison.",https://www.lapresse.ca/voyage/quebec-et-canada/2020-12-26/a-fond-dans-le-ski.php
Publié le 24 déc. 2020,Ouvert ou fermé pour Noël ?,"Les centres commerciaux seront-ils ouverts au lendemain de Noël ? Qu’en est-il des services de transport, banques et bibliothèques ? Avec la fermeture des commerces non essentiels qui débutera le 25 décembre, a préparé une liste des établissements et services qui demeureront ouverts entre les 24 et 26 décembre.",https://www.lapresse.ca/actualites/2020-12-24/ouvert-ou-ferme-pour-noel.php
Publié le 21 déc. 2020,Le service humanitaire sur roues,"La Mission Old Brewery a inauguré au début du mois le nouvel ajout à son service de navette : le Solidaribus, un autobus prêté par la STM, dont le mandat est de transporter les personnes en situation d’itinérance vers des ressources d’accueil et d’hébergement. est montée à bord lors d’une de ses tournées.",https://www.lapresse.ca/societe/2020-12-21/solidaribus/le-service-humanitaire-sur-roues.php
Publié le 20 déc. 2020,Don de 100 000 masques,"Après avoir fait don de 10 000 masques de protection à la Société de transport de Montréal (STM) en mai dernier, Métallifer, une entreprise de Lévis spécialisée dans la fabrication de pièces industrielles revient à la charge et offre 100 000 masques de protection à des résidences de personnes âgées (RPA) et différents organismes communautaires des régions de Québec, Lévis et Chaudière-Appalaches. L’annonce a été faite le 18 décembre dernier.",https://www.lapresse.ca/affaires/tetes-d-affiche/2020-12-20/don-de-100-000-masques.php
Publié le 16 déc. 2020,Le transport en commun espère rebondir après la pandémie,"(Montréal) La pandémie de COVID-19 a entraîné une chute importante de la fréquentation des transports en commun à travers le Canada, mais de nombreuses villes ont décidé de maintenir les niveaux de service cette année, tandis que d’autres ont même choisi de développer leur réseau.",https://www.lapresse.ca/actualites/covid-19/2020-12-16/le-transport-en-commun-espere-rebondir-apres-la-pandemie.php
Publié le 4 déc. 2020,"La station Henri-Bourassa évacuée, plusieurs stations affectées","La station de métro Henri-Bourassa a été évacuée vendredi après-midi après qu’un conflit a visiblement dégénéré entre des jeunes. L’un d’eux a notamment aspergé un autre de poivre de Cayenne, forçant la Société de transport de Montréal (STM) à interrompre le service sur une bonne partie de la ligne orange.",https://www.lapresse.ca/actualites/justice-et-faits-divers/2020-12-04/poivre-de-cayenne-lors-d-un-conflit/la-station-henri-bourassa-evacuee-plusieurs-stations-affectees.php
