raw_date,raw_title,raw_description,link
Publié le 29 mars 2024,"La misère, d’une station à l’autre","Station Berri-UQAM, mercredi, 9 h 30. Des dizaines de travailleurs et d’étudiants commencent leur journée. Quelques sans-abri errent dans les couloirs. Des policiers et constables spéciaux sont bien visibles sur la mezzanine centrale, avec leurs uniformes et leurs dossards fluo.",https://www.lapresse.ca/actualites/grand-montreal/sentiment-d-insecurite/une-journee-dans-le-metro/2024-03-29/la-misere-d-une-station-a-l-autre.php
Publié le 29 mars 2024,Le SPVM « plus efficace » dans le réseau,"Ce n’est pas ce que les usagers de la STM souhaiteraient entendre, mais les maux à l’origine de la vague d’insécurité dans le métro « ne diminueront pas, c’est sûr et certain », estime la grande patronne des policiers affectés au réseau souterrain.",https://www.lapresse.ca/actualites/grand-montreal/une-journee-dans-le-metro/2024-03-29/le-spvm-plus-efficace-dans-le-reseau.php
Publié le 29 mars 2024,La STM appelle à l’aide,"Dépassée par l’augmentation du sentiment d’insécurité dans le métro, la Société de transport de Montréal (STM) veut « revoir le modèle » d’intervention auprès des personnes vulnérables en impliquant plus de ressources. En attendant, plusieurs solutions existent pour redonner confiance aux usagers, plaident des spécialistes.",https://www.lapresse.ca/actualites/grand-montreal/2024-03-29/insecurite-dans-le-metro/la-stm-appelle-a-l-aide.php
Publié le 25 mars 2024,Ottawa n’exclut pas d’accélérer le financement,"Le ministre des Transports du Canada, Pablo Rodriguez, n’exclut pas de devancer le financement associé au nouveau Fonds permanent pour le transport en commun, afin de soutenir les transporteurs. Mais il rétorque du même coup à Québec que son gouvernement ne s’est « jamais désengagé » en matière de mobilité durable.",https://www.lapresse.ca/actualites/politique/2024-03-25/transport-collectif/ottawa-n-exclut-pas-d-accelerer-le-financement.php
Publié le 22 mars 2024,Un suspect arrêté concernant l’agression du père d’Alexandre Champagne,"Un homme soupçonné d’avoir agressé le père de l’humoriste Alexandre Champagne à la station de métro Jean-Talon a été arrêté vendredi, confirme le Service de police de la Ville de Montréal (SPVM).",https://www.lapresse.ca/actualites/justice-et-faits-divers/2024-03-22/station-de-metro-jean-talon/un-suspect-arrete-concernant-l-agression-du-pere-d-alexandre-champagne.php
Publié le 22 mars 2024,Prendre le métro est devenu stressant,"Chaque vendredi, nous revenons sur la semaine médiatique d’une personnalité, d’une institution ou d’un dossier qui s’est retrouvé au cœur de l’actualité",https://www.lapresse.ca/dialogue/chroniques/2024-03-22/grosse-semaine-pour-la-securite-dans-le-metro-de-montreal/prendre-le-metro-est-devenu-stressant.php
Publié le 22 mars 2024,Les plaintes des usagers ont triplé depuis 10 ans,"La cohabitation est de plus en plus tendue dans le réseau du métro. Le nombre des plaintes à la Société de transport de Montréal (STM) a triplé l’an dernier, surtout à cause de l’itinérance et de la consommation de drogue et d’alcool, révèlent les données obtenues par .",https://www.lapresse.ca/actualites/grand-montreal/2024-03-22/metro-de-montreal/les-plaintes-des-usagers-ont-triple-depuis-10-ans.php
Publié le 21 mars 2024,Une balade en métro vers nulle part ?,"« Geneviève Guilbault dans le métro. » C’était le titre d’une chronique de mars 2023, quand j’avais accompagné la nouvelle ministre des Transports dans les méandres du réseau de Paris.",https://www.lapresse.ca/actualites/chroniques/2024-03-21/une-balade-en-metro-vers-nulle-part.php
Publié le 20 mars 2024,Climat violent dans un garage d’autobus,"Rien ne va plus au garage d’autobus Legendre de la Société de transport de Montréal (STM), où un climat de travail toxique a pris un tournant carrément violent dans les derniers mois, selon des rapports de santé et sécurité du travail.",https://www.lapresse.ca/actualites/grand-montreal/2024-03-20/societe-de-transport-de-montreal/climat-violent-dans-un-garage-d-autobus.php
Publié le 19 mars 2024,"Montréal, Toronto et Vancouver réclament au fédéral d’accélérer","Confrontées à « l’explosion de la croissance démographique et des pressions financières croissantes », les sociétés de transport de Montréal, Toronto et Vancouver font front commun et pressent Ottawa de devancer ses investissements en transport collectif.",https://www.lapresse.ca/actualites/politique/2024-03-19/financement-du-transport-collectif/montreal-toronto-et-vancouver-reclament-au-federal-d-accelerer.php
Publié le 19 mars 2024,« Un phénomène social plus grand que nous »,"Les agressions contre les employés du réseau ont augmenté de 6 % l’an dernier, révèlent les chiffres de la Société de transport de Montréal (STM). La situation est telle que la STM lancera bientôt une campagne pour demander aux clients de respecter son personnel.",https://www.lapresse.ca/actualites/stm/les-agressions-contre-les-employes-en-hausse/2024-03-19/un-phenomene-social-plus-grand-que-nous.php
Publié le 19 mars 2024,Des cabines anti-agression réclamées,"Devant la hausse du nombre d’incidents rapportés par les chauffeurs d’autobus de la Société de transport de Montréal (STM), leur syndicat redemande qu’ils soient protégés par des cabines anti-agression.",https://www.lapresse.ca/actualites/stm/les-agressions-contre-les-employes-en-hausse/2024-03-19/des-cabines-anti-agression-reclamees.php
Publié le 19 mars 2024,Les agressions contre les employés en hausse,"Au moins 348 agressions – surtout contre des chauffeurs d’autobus et des constables spéciaux – ont été répertoriées l’an dernier, une augmentation de 6 % par rapport à 2022. Et chez certains usagers du réseau, c’est le sentiment d’insécurité qui s’accentue.",https://www.lapresse.ca/actualites/2024-03-19/stm/les-agressions-contre-les-employes-en-hausse.php
Publié le 19 mars 2024,Un sentiment d’insécurité croissant chez les usagers,"« L’autre jour, un homme m’a frappée. Il m’a donné un coup de pied et il est parti ! », s’exclame Nora Hammouch, pointant l’emplacement du coup sur sa cuisse.",https://www.lapresse.ca/actualites/stm/les-agressions-contre-les-employes-en-hausse/2024-03-19/un-sentiment-d-insecurite-croissant-chez-les-usagers.php
Publié le 16 mars 2024,"Des logos beaux, bons, durables","Quelques logos porteurs d’enseignements, aux yeux de nos expertes.",https://www.lapresse.ca/affaires/entreprises/c-est-quoi-un-bon-logo-et-combien-ca-coute/2024-03-16/des-logos-beaux-bons-durables.php
Publié le 12 mars 2024,Le « flou » autour des investissements en transport collectif inquiète,"Des élus municipaux de la région métropolitaine craignent que l’offre de services en transport collectif soit de nouveau mise à risque en raison de l’absence d’un cadre financier prévisible dans le budget 2024 de Québec. À leurs inquiétudes s’ajoutent celles des sociétés de transport, qui déplorent le manque « d’engagement » du gouvernement.",https://www.lapresse.ca/actualites/2024-03-12/budget-du-quebec-2024/le-flou-autour-des-investissements-en-transport-collectif-inquiete.php
Publié le 11 mars 2024,Ces femmes qui vous inspirent,"« Et vous, qui vous inspire ? », demandait Dominique Anglade dans un texte publié vendredi à l’occasion de la Journée internationale des droits des femmes. Dans vos réponses, vous avez cité des femmes qui brillent sur la scène publique, bien sûr, mais aussi vos sœurs, vos mères, vos amies et vos amoureuses. Voici quelques-uns des messages que nous avons reçus.",https://www.lapresse.ca/dialogue/courrier-des-lecteurs/2024-03-11/place-aux-lecteurs/ces-femmes-qui-vous-inspirent.php
Publié le 10 mars 2024,Un syndicat dénonce l’omniprésence des consultants,"Un important syndicat de professionnels demande à la Société de transport de Montréal (STM) de réduire l’effectif de centaines de consultants qui travaillent chaque jour dans ses bureaux avant de supprimer des postes comme elle l’a fait le mois dernier. Une opération qui risque de se répéter, alors que le déficit des transports en commun demeure béant.",https://www.lapresse.ca/actualites/grand-montreal/2024-03-10/societe-de-transport-de-montreal/un-syndicat-denonce-l-omnipresence-des-consultants.php
Publié le 9 mars 2024,Grande cure de jouvence,"Un vaste chantier se mettra en branle lundi à la station Saint-Michel, dans l’est de Montréal, au coût de 14 millions de dollars. La Société de transport de Montréal (STM) rénovera l’ensemble de cet espace névralgique du métro, dont l’achalandage grimpera sûrement avec le prolongement de la ligne bleue.",https://www.lapresse.ca/actualites/grand-montreal/2024-03-09/station-de-metro-saint-michel/grande-cure-de-jouvence.php
Publié le 6 mars 2024,La gare Lucien-L’Allier fermée dès le 1er avril pour des travaux majeurs,"Les travaux majeurs prévus à la gare Lucien-L’Allier seront finalement lancés à compter du 1er avril prochain. Le vaste chantier entraînera la fermeture du terminus de trois lignes importantes de trains de banlieue, au centre-ville de Montréal, pendant 6 à 12 mois.",https://www.lapresse.ca/actualites/grand-montreal/2024-03-06/trains-de-banlieue/la-gare-lucien-l-allier-fermee-des-le-1er-avril-pour-des-travaux-majeurs.php
Publié le 4 mars 2024,Collision mortelle entre un autobus de la STM et un piéton,Un homme a perdu la vie lundi soir après avoir été happé par un autobus de la Société de transport de Montréal (STM) dans l’arrondissement de Saint-Laurent.,https://www.lapresse.ca/actualites/justice-et-faits-divers/2024-03-04/montreal/collision-mortelle-entre-un-autobus-de-la-stm-et-un-pieton.php
Publié le 4 mars 2024,La STM pourrait s’inspirer de Paris pour réduire les arrêts de service,"Le métro de Paris n’interrompra plus son service quand un passager subit un malaise à bord d’un wagon, afin de minimiser les arrêts de service. La Société de transport de Montréal (STM) juge cette approche « intéressante » et envisage aussi certains ajustements.",https://www.lapresse.ca/actualites/grand-montreal/2024-03-04/malaises-dans-le-metro/la-stm-pourrait-s-inspirer-de-paris-pour-reduire-les-arrets-de-service.php
Publié le 1 mars 2024,Vers une nouvelle génération de véhicules,"Encore trop d’autobus électriques sont inutilisés en raison de leur faible autonomie, surtout dans le milieu scolaire. L’un des principaux fournisseurs, Lion Électrique, livrera toutefois bientôt une nouvelle génération de véhicules avec une autonomie de 250 kilomètres. Dans le secteur urbain, Nova Bus atteint déjà les 300 kilomètres.",https://www.lapresse.ca/actualites/2024-03-01/autobus-electriques/vers-une-nouvelle-generation-de-vehicules.php
Publié le 27 févr. 2024,Environ 1700 autobus dorment dans des garages,"Environ 1700 autobus prennent actuellement la poussière dans des garages des sociétés de transport au Canada, les transporteurs n’ayant pas l’argent pour les faire rouler, s’inquiète un nouveau rapport commandé par deux organisations écologistes. S’ils étaient mis en service, ces véhicules pourraient faire bondir l’offre de service.",https://www.lapresse.ca/actualites/2024-02-27/etude-sur-le-transport-collectif-au-canada/environ-1700-autobus-dorment-dans-des-garages.php
Publié le 22 févr. 2024,Le champion mondial des pannes causées par les usagers,"C’est dans le métro de Montréal que l’on compte le plus grand nombre d’interruptions de service causées par la clientèle dans le monde entier, révèlent des données internationales. Celles-ci mettent de nouveau en relief l’importance d’un futur système de portes palières, qui est toujours sur la glace.",https://www.lapresse.ca/actualites/grand-montreal/2024-02-22/metro-de-montreal/le-champion-mondial-des-pannes-causees-par-les-usagers.php
Publié le 21 févr. 2024,Le service reprend après une panne sur les quatre lignes,"Les quatre lignes du métro de Montréal ont été paralysées pendant quelques dizaines de minutes sur l’heure du midi, mercredi, en raison d’une panne du système de communication.",https://www.lapresse.ca/actualites/grand-montreal/2024-02-21/metro-de-montreal/le-service-reprend-apres-une-panne-sur-les-quatre-lignes.php
Publié le 21 févr. 2024,Ma canne blanche sous les roues d’un autobus,"Dernièrement, j’ai profité d’une belle matinée ensoleillée d’hiver pour faire une marche de santé dans mon quartier du Plateau-Mont-Royal. À l’intersection du boulevard Saint-Joseph et de l’avenue Christophe-Colomb, un autobus de la STM a roulé sur ma canne blanche. Je l’ai échappé belle.",https://www.lapresse.ca/dialogue/opinions/2024-02-21/pietons-aveugles-et-malvoyants/ma-canne-blanche-sous-les-roues-d-un-autobus.php
Publié le 15 févr. 2024,Des nouveaux revenus de près d’un milliard proposés à Québec,"Près d’un milliard de dollars sont à la portée de Québec pour mieux financer le transport collectif, selon un regroupement d’organismes, qui appelle à indexer les taxes sur le carburant et l’immatriculation en plus de rehausser les revenus du marché carbone.",https://www.lapresse.ca/actualites/politique/2024-02-15/transport-collectif/des-nouveaux-revenus-de-pres-d-un-milliard-proposes-a-quebec.php
Publié le 13 févr. 2024,217 millions pour le nouveau « cerveau » de la ligne bleue,La Société de transport de Montréal (STM) a trouvé l’entreprise qui fournira le nouveau « cerveau » de la ligne bleue du métro de Montréal et de son prolongement.,https://www.lapresse.ca/actualites/grand-montreal/2024-02-13/metro-de-montreal/217-millions-pour-le-nouveau-cerveau-de-la-ligne-bleue.php
Publié le 13 févr. 2024,Reprise du service sur la ligne orange,Le service du métro de Montréal a été brièvement interrompu mardi matin entre les stations Snowdon et Berri-UQAM,https://www.lapresse.ca/actualites/grand-montreal/2024-02-13/metro/reprise-du-service-sur-la-ligne-orange.php
Publié le 10 févr. 2024,La situation financière est « intenable »,"Malgré la récente bouée de sauvetage du gouvernement, l’Autorité régionale de transport métropolitain (ARTM) lance un nouvel appel à l’aide, anticipant un manque à gagner d’un demi-milliard. Près de quatre ans après l’arrivée de la COVID-19, plus d’un usager sur cinq n’est toujours pas remonté à bord du transport collectif, ce qui laisse planer le spectre de fortes compressions dans les prochaines années.",https://www.lapresse.ca/actualites/grand-montreal/2024-02-10/transport-collectif/la-situation-financiere-est-intenable.php
Publié le 9 févr. 2024,L’heure des choix pour le transport collectif,"La STM a confirmé, au début du mois, des compressions budgétaires sans précédent dans son histoire, avec 86 millions de dépenses récurrentes coupées sans toucher à son niveau de service, ce qui représente un effort équivalent à 5 % de son budget.",https://www.lapresse.ca/dialogue/opinions/2024-02-09/financement/l-heure-des-choix-pour-le-transport-collectif.php
Publié le 8 févr. 2024,La Nuit blanche dévoile sa programmation,"Évènement signature de l’hiver montréalais, la Nuit blanche aura lieu cette année du 2 au 3 mars. Au programme de cette 21e édition, plus de 100 activités dans huit pôles de la métropole autour d’un seul thème : le fantasme.",https://www.lapresse.ca/arts/2024-02-08/du-2-au-3-mars-2024/la-nuit-blanche-devoile-sa-programmation.php
Publié le 7 févr. 2024,Une aide de 622 millions réclamée à Québec pour 2025,L’Association du transport urbain du Québec (ATUQ) réclame à Québec une aide de 622 millions de dollars pour 2025 « afin de préserver l’offre de service » en transport collectif. L’organisme souhaite aussi signer une entente sur cinq ans d’ici l’automne prochain.,https://www.lapresse.ca/actualites/politique/2024-02-07/transport-collectif/une-aide-de-622-millions-reclamee-a-quebec-pour-2025.php
Publié le 7 févr. 2024,Des jalons du calendrier repoussés,"Des jalons importants du calendrier de prolongement de la ligne bleue ont été reportés, dans les dernières semaines, en amont de la clôture du plus important appel d’offres du projet.",https://www.lapresse.ca/actualites/grand-montreal/2024-02-07/prolongement-de-la-ligne-bleue/des-jalons-du-calendrier-repousses.php
Publié le 6 févr. 2024,L’IA pour prévenir les tentatives de suicide,"Le métro de Montréal pourrait bientôt être équipé d’un système de surveillance en intelligence artificielle qui détecterait les comportements précédant des tentatives de suicide afin d’en réduire le nombre, a appris . Au besoin, une alarme pourrait notamment être envoyée aux chauffeurs afin d’éviter le pire.",https://www.lapresse.ca/actualites/grand-montreal/2024-02-06/metro/l-ia-pour-prevenir-les-tentatives-de-suicide.php
Publié le 6 févr. 2024,Le beau risque du Stade,"Cela aurait pu être un fiasco monumental, voire un embarras international pour Montréal, mais la reconstruction annoncée du Stade olympique pourrait en fin de compte constituer un moment charnière dans la manière de réaliser de grands projets d’infrastructures au Québec.",https://www.lapresse.ca/actualites/chroniques/2024-02-06/le-beau-risque-du-stade.php
Publié le 3 févr. 2024,« Des enjeux de sécurité » dans le terminus tout neuf,"Le terminus d’autobus du métro Rosemont est toujours fermé, après un an et demi de travaux, parce qu’il est jugé potentiellement dangereux par la Société de transport de Montréal (STM). Au grand dam des personnes à mobilité réduite, forcées de faire des détours.",https://www.lapresse.ca/actualites/grand-montreal/2024-02-03/metro-rosemont/des-enjeux-de-securite-dans-le-terminus-tout-neuf.php
Publié le 2 févr. 2024,Place aux audits de performance de Geneviève Guilbault,"La ministre des Transports, Geneviève Guilbault, est sur le point de lancer ses audits de performance qui évalueront la gestion financière des dix sociétés de transport au Québec. Un mandat sera confié dès le 12 février prochain à la firme Raymond Chabot Grant Thornton.",https://www.lapresse.ca/actualites/politique/2024-02-02/transport-collectif/place-aux-audits-de-performance-de-genevieve-guilbault.php
Publié le 1 févr. 2024,"Le couperet tombe à la STM, 230 postes supprimés","En difficulté financière, la Société de transport de Montréal (STM) devra finalement éliminer 230 postes, l’équivalent d’une baisse de 5 % sur sa masse salariale. Le transporteur assure que ces compressions n’affecteront pas le niveau de service, mais ne cache pas qu’il craint pour la suite en 2025.",https://www.lapresse.ca/actualites/grand-montreal/2024-02-01/transport-collectif/le-couperet-tombe-a-la-stm-230-postes-supprimes.php
Publié le 1 févr. 2024,Changement de garde à l’itinérance,"La mairesse Valérie Plante a décidé de changer de responsable du dossier de l’itinérance, à l’heure où l’enjeu est au cœur de l’actualité.",https://www.lapresse.ca/actualites/grand-montreal/2024-02-01/comite-executif-de-l-administration-plante/changement-de-garde-a-l-itinerance.php
Publié le 31 janv. 2024,« On n’a pas une minute à perdre »,"Ils sont les yeux du métro, mais aussi ceux qu’on n’y voit jamais. Toutes les nuits, des centaines d’employés de la Société de transport de Montréal (STM) s’affairent à réparer les problèmes de la « colonne vertébrale » de la mobilité de la métropole. Et ils ont entre trois et quatre heures, parfois moins, pour parer au plus urgent. a passé une nuit sous terre avec l’une de ces équipes.",https://www.lapresse.ca/actualites/grand-montreal/2024-01-31/une-nuit-dans-le-metro/on-n-a-pas-une-minute-a-perdre.php
Publié le 26 janv. 2024,Arrêt de service terminé sur la ligne orange,"La ligne orange du métro de Montréal a été paralysée entre les stations Berri-UQAM et Henri-Bourassa pendant un total de plus de trois heures vendredi, mais la situation finalement est revenue à la normale.",https://www.lapresse.ca/actualites/grand-montreal/2024-01-26/metro-de-montreal/arret-de-service-termine-sur-la-ligne-orange.php
Publié le 26 janv. 2024,Le premier projet immobilier de la STM achoppe,"La première incursion de la Société de transport de Montréal (STM) dans le domaine du développement immobilier – 274 logements au métro Frontenac – a du plomb dans l’aile, a appris .",https://www.lapresse.ca/actualites/grand-montreal/2024-01-26/274-logements-au-metro-frontenac/le-premier-projet-immobilier-de-la-stm-achoppe.php
Publié le 25 janv. 2024,Des constables spéciaux de plus en plus sollicités dans le métro,"Le nombre d’appels pour faire intervenir des constables spéciaux a bondi en 2023 dans le métro, a révélé jeudi la Société de transport de Montréal (STM). Devant l’insécurité grandissante, le transporteur ajoute des dizaines d’agents en renfort.",https://www.lapresse.ca/actualites/grand-montreal/2024-01-25/47-000-signalements-en-2023/des-constables-speciaux-de-plus-en-plus-sollicites-dans-le-metro.php
Publié le 23 janv. 2024,François Lambert lorgne la mairie de Montréal,"Dénonçant comme Pierre Poilievre l’« incompétence » de Valérie Plante, l’entrepreneur François Lambert a affirmé qu’il songeait à la mairie de Montréal, devenu selon lui « ville de riches ».",https://www.lapresse.ca/actualites/grand-montreal/2024-01-23/francois-lambert-lorgne-la-mairie-de-montreal.php
Publié le 22 janv. 2024,Des millions de la STM retenus pendant un mois,"De vives tensions ont déchiré en coulisse les acteurs du transport en commun de la métropole l’an dernier, paralysant même le financement de la Société de transport de Montréal (STM) pendant un mois. Une situation qui s’était déjà produite par le passé.",https://www.lapresse.ca/actualites/grand-montreal/2024-01-22/transport-en-commun/des-millions-de-la-stm-retenus-pendant-un-mois.php
Publié le 21 janv. 2024,Le pneu crevé,"Il n’y aura pas de chialage dans cette chronique. Je n’ai pas de chemise à déchirer, aujourd’hui. Chronique tranche de vie.",https://www.lapresse.ca/actualites/chroniques/2024-01-21/le-pneu-creve.php
Publié le 19 janv. 2024,"Le raccourci bientôt ouvert à la Place Bonaventure, croit le propriétaire","Un raccourci qui permettrait à des milliers de voyageurs d’économiser du temps de transfert entre le métro et le REM au centre-ville de Montréal devrait bientôt ouvrir, selon Place Bonaventure.",https://www.lapresse.ca/actualites/grand-montreal/2024-01-19/transfert-entre-le-rem-et-le-metro/le-raccourci-bientot-ouvert-a-la-place-bonaventure-croit-le-proprietaire.php
Publié le 19 janv. 2024,« Il faut se lancer dans des choses qu’on ne connaît pas »,"Tous les vendredis, une personne de la communauté des affaires se dévoile dans notre section. Cette semaine, Hélène Godin, présidente-directrice générale, cofondatrice et cheffe de l’innovation pédagogique de La Factry – École des sciences de la créativité, répond à nos questions.",https://www.lapresse.ca/affaires/2024-01-19/dix-questions-a-helene-godin/il-faut-se-lancer-dans-des-choses-qu-on-ne-connait-pas.php
Publié le 18 janv. 2024,Les hauts et les bas du transport collectif,"Mercredi, nous vous demandions de nous partager vos expériences avec les transports en commun. Voici quelques-unes de vos réactions.",https://www.lapresse.ca/dialogue/courrier-des-lecteurs/2024-01-18/place-aux-lecteurs/les-hauts-et-les-bas-du-transport-collectif.php
Publié le 17 janv. 2024,L’ARTM veut faciliter le renouvellement des cartes OPUS,"Les personnes âgées, les étudiants et les autres usagers bénéficiant de rabais tarifaires n’auront bientôt plus besoin d’aller en billetterie pour renouveler leur carte OPUS. D’ici peu, l’Autorité régionale de transport métropolitain (ARTM) aimerait pouvoir valider leur identité à distance et procéder de façon 100 % numérique.",https://www.lapresse.ca/actualites/grand-montreal/2024-01-17/aines-et-etudiants/l-artm-veut-faciliter-le-renouvellement-des-cartes-opus.php
Publié le 15 janv. 2024,"Mont-Royal et Hampstead, champions du déneigement","Ce sont les villes liées de Mont-Royal et de Hampstead qui déneigent le mieux leurs arrêts d’autobus durant les bordées de neige dans la métropole. C’est du moins ce que montrent des données de l’organisme Transit, qui espère ainsi encourager les arrondissements à faire mieux en matière de confort et d’accessibilité pour les usagers.",https://www.lapresse.ca/actualites/grand-montreal/2024-01-15/arrets-d-autobus/mont-royal-et-hampstead-champions-du-deneigement.php
Publié le 12 janv. 2024,Un tramway pour une fraction du prix,"C’est un tramway qui sera finalement recommandé au gouvernement Legault pour remplacer le REM de l’Est plutôt que le tracé souterrain à 36 milliards proposé l’été dernier, a appris . La facture serait réduite au moins de moitié pour atteindre environ 13 milliards.",https://www.lapresse.ca/actualites/grand-montreal/2024-01-12/projet-structurant-de-l-est/un-tramway-pour-une-fraction-du-prix.php
Publié le 2 janv. 2024,Un dégagement de fumée provoque des interruptions de service,"(Montréal) Les deux interruptions de service du métro de Montréal qui ont été décrétées mardi matin par la Société de transport de Montréal (STM) ont pris fin vers 9 h 05, tel que prévu.",https://www.lapresse.ca/actualites/grand-montreal/2024-01-02/metro-de-montreal/un-degagement-de-fumee-provoque-des-interruptions-de-service.php
