raw_date,raw_title,raw_description,link
Publié le 30 août 2022,« Les gens sont mêlés » par la refonte tarifaire,"La période de la rentrée est toujours très occupée pour les employés de la Société de transport de Montréal (STM), mais cette année, ils font face à un défi encore plus grand en raison de la refonte des titres de transport qui donne des maux de tête aux usagers.",https://www.lapresse.ca/actualites/grand-montreal/2022-08-30/transports-en-commun/les-gens-sont-meles-par-la-refonte-tarifaire.php
Publié le 29 août 2022,Holness veut taxer l’entrée sur l’île de Montréal pour les non-résidants,"Le chef de Bloc Montréal, Balarama Holness, veut imposer un « droit de congestion » de cinq dollars par jour à tous les véhicules appartenant à des non-résidants qui entrent sur l’île de Montréal, soit l’équivalent de 1300 $ annuellement pour un travailleur qui s’y rend cinq jours par semaine.",https://www.lapresse.ca/elections-quebecoises/2022-08-29/bloc-montreal/holness-veut-taxer-l-entree-sur-l-ile-de-montreal-pour-les-non-residants.php
Publié le 27 août 2022,Une 30e année au rythme de la nouveauté,"Le Marathon Beneva de Montréal est le grand rituel annuel des coureuses et coureurs de la métropole et du Québec. Du 23 au 25 septembre, l’évènement, qui souffle ses 30 bougies cette année, s’accompagnera d’une série de nouveautés, toutes propices à combler les adeptes de courtes et de longues distances. Que nous réserve ce nouveau départ ?",https://www.lapresse.ca/xtra/2022-08-27/marathon-beneva-de-montreal/une-30e-annee-au-rythme-de-la-nouveaute.php
Publié le 19 août 2022,Des alarmes de recul qui « gâchent la vie » des résidants,"Depuis plus de trois ans, Zoe Brashaw doit vivre avec le bruit des alarmes de recul de véhicules lourds qui retentissent toute la journée, parfois même avant 7 h le matin.",https://www.lapresse.ca/actualites/grand-montreal/2022-08-19/chantier-de-la-stm/des-alarmes-de-recul-qui-gachent-la-vie-des-residants.php
Publié le 17 août 2022,Des personnes handicapées privées d’un accompagnateur,"Depuis lundi, des personnes handicapées ne peuvent plus compter sur la présence d’un accompagnateur lorsqu’elles utilisent le transport adapté de la Société de transport de Montréal (STM), une situation qui les rend vulnérables et qu’elles dénoncent.",https://www.lapresse.ca/actualites/2022-08-17/transport-adapte/des-personnes-handicapees-privees-d-un-accompagnateur.php
Publié le 14 août 2022,Le courrier des lecteurs,"Finances personnelles, investissement, consommation… Une fois par mois, la chroniqueuse Marie-Eve Fournier fait le tour des petites et grandes questions qui préoccupent les lecteurs de .",https://www.lapresse.ca/affaires/chroniques/2022-08-14/le-courrier-des-lecteurs.php
Publié le 12 août 2022,L’ex-président de la STM Philippe Schnobb mènera l’enquête,"C’est l’ancien président du conseil d’administration de la Société de transport de Montréal (STM), Philippe Schnobb, qui sera chargé de mener l’enquête indépendante sur Fierté Montréal, dans la foulée de l’annulation surprise et fortement dénoncée du défilé, dimanche dernier. La Ville dit d’abord et avant tout vouloir « rétablir la confiance du public envers l’organisme ».",https://www.lapresse.ca/actualites/grand-montreal/2022-08-12/defile-de-fierte-montreal-annule/l-ex-president-de-la-stm-philippe-schnobb-menera-l-enquete.php
Publié le 4 août 2022,Une direction sera fermée durant trois ans dès novembre prochain,"Trois des six voies du tunnel Louis-Hippolyte-Lafontaine seront fermées de novembre 2022 à la fin de 2025, a annoncé le ministère des Transports du Québec (MTQ) jeudi. La circulation dans les deux sens sera donc concentrée sur les trois voies restantes, à raison de deux voies en direction de Montréal et d’une en direction de la Rive-Sud, allongeant considérablement les temps de déplacement.",https://www.lapresse.ca/actualites/grand-montreal/2022-08-04/tunnel-louis-hippolyte-la-fontaine/une-direction-sera-fermee-durant-trois-ans-des-novembre-prochain.php
Publié le 22 juil. 2022,La STM veut faire la preuve qu’elle est un « bon investissement »,"Pour regagner l’ensemble de sa fréquention au sortir de la pandémie de COVID-19, la Société de transport de Montréal (STM) compte « se réinventer », mais surtout faire la démonstration aux différents gouvernements qu’elle est un « bon investissement ».",https://www.lapresse.ca/actualites/grand-montreal/2022-07-22/marie-claude-leonard-nommee-dg/la-stm-veut-faire-la-preuve-qu-elle-est-un-bon-investissement.php
Publié le 21 juil. 2022,La station Place-des-Arts désormais accessible,"La station de métro Place-des-Arts, dans le quartier des Spectacles de Montréal, devient la 21e à être accessible aux personnes à mobilité réduite. Les ascenseurs sont fonctionnels depuis jeudi.",https://www.lapresse.ca/actualites/grand-montreal/2022-07-21/accessibilite-universelle/la-station-place-des-arts-desormais-accessible.php
Publié le 19 juil. 2022,La station Mont-Royal fait peau neuve,"La Société de transport de Montréal (STM) a dévoilé mardi le nouvel édicule de la station de métro Mont-Royal, en travaux depuis 2018. Les escaliers mécaniques seront toutefois inaccessibles jusqu’à la fin des travaux, l’automne prochain.",https://www.lapresse.ca/actualites/grand-montreal/2022-07-19/acces-universel/la-station-mont-royal-fait-peau-neuve.php
Publié le 17 juil. 2022,Huit semaines de vacances dès l’embauche,"Huit à neuf semaines de vacances dès l’embauche. Du télétravail illimité — même à l’étranger — pour tous les employés qui le demandent. La flexibilité de choisir ses avantages sociaux en fonction de ses besoins. La PME de Boucherville Tootelo a commencé à dérouler le tapis rouge à ses employés bien avant la pénurie de main-d’œuvre actuelle, et la stratégie semble aujourd’hui porter ses fruits.",https://www.lapresse.ca/affaires/entreprises/2022-07-17/conditions-de-travail-etonnantes/huit-semaines-de-vacances-des-l-embauche.php
Publié le 11 juil. 2022,La STM critiquée pour un contrat résilié octroyé à la même entreprise,La Société de transport de Montréal (STM) vient d’octroyer un contrat à une entreprise avec laquelle ses liens d’affaires ont tout récemment été dénoncés par le Bureau de l’inspecteur général (BIG). L’opposition officielle s’est dite lundi « scandalisée » par la situation.,https://www.lapresse.ca/actualites/grand-montreal/2022-07-11/contrat-en-services-conseils/la-stm-critiquee-pour-un-contrat-resilie-octroye-a-la-meme-entreprise.php
Publié le 2 juil. 2022,Et si tout se trouvait dans une seule application ?,"BIXI, Communauto, métro, bus, taxi, covoiturage : que diriez-vous de payer une seule fois par mois pour tous les services de transport collectif ou actif à Montréal, en fonction de votre utilisation, dans une seule et même application ? C’est à ce chantier de longue haleine que travaille actuellement l’Autorité régionale de transport métropolitain (ARTM).",https://www.lapresse.ca/actualites/grand-montreal/2022-07-02/transports-collectif-et-actif/et-si-tout-se-trouvait-dans-une-seule-application.php
Publié le 24 juin 2022,Début de l’accès gratuit à des stations du centre-ville les fins de semaine,"La journée de vendredi marque la fête nationale, mais aussi le début de la gratuité d’accès dans sept stations de métro, au centre-ville et près du Vieux-Montréal, la fin de semaine et les jours fériés. Les premiers usagers ont d’ailleurs pu bénéficier de cette nouvelle mesure dès la levée du jour.",https://www.lapresse.ca/actualites/grand-montreal/2022-06-24/metro-de-montreal/debut-de-l-acces-gratuit-a-des-stations-du-centre-ville-les-fins-de-semaine.php
Publié le 19 juin 2022,Lobbying et politique : la saga d’Oxygène 9,"(Québec ) Un ministre peut-il souper avec un ami lobbyiste ? La question s’est posée, il y a quelques jours, quand on a évoqué l’amitié entre Pierre Fitzgibbon et le lobbyiste Luc Laperrière. Le ministre avait soupé avec ce dernier qui avait, dans le passé, fait des démarches au bénéfice d’une entreprise, Polycor. Au même moment, en mai dernier, la firme avait bénéficié d’un investissement de 100 millions du gouvernement.",https://www.lapresse.ca/actualites/analyses/2022-06-19/lobbying-et-politique-la-saga-d-oxygene-9.php
Publié le 17 juin 2022,La cause de l’infiltration d’eau sur la ligne bleue toujours inconnue,La cause d’infiltration d’eau qui a causé un arrêt de trois heures sur la ligne bleue du métro à la suite des précipitations abondantes jeudi soir à Montréal est toujours inconnue. La Société des transports de Montréal (STM) cherche encore à savoir comment l’eau aurait pénétré les tunnels.,https://www.lapresse.ca/actualites/grand-montreal/2022-06-17/la-cause-de-l-infiltration-d-eau-sur-la-ligne-bleue-toujours-inconnue.php
Publié le 17 juin 2022,La ligne orange aura bientôt droit à son « mini-prolongement »,"Après cinq ans de travaux, l’heure d’ouverture approche pour le garage Côte-Vertu de la Société de transport de Montréal (STM), qui permettra une hausse marquée du service aux heures de pointe. Des tunnels ont aussi commencé à y être excavés, pour un éventuel prolongement de la ligne orange vers Bois-Franc.",https://www.lapresse.ca/actualites/grand-montreal/2022-06-17/garage-cote-vertu/la-ligne-orange-aura-bientot-droit-a-son-mini-prolongement.php
Publié le 15 juin 2022,Le transport scolaire pâtira du manque de chauffeurs,"Le service de transport scolaire de la Société de transport de Montréal (STM) pourrait être « réduit » dans les prochains jours, à l’aube des examens de fin d’année. Devant un « manque d’effectifs », la STM risque en effet de devoir réduire une partie de son service de « lignes-écoles dédiées ».",https://www.lapresse.ca/actualites/grand-montreal/2022-06-15/stm/le-transport-scolaire-patira-du-manque-de-chauffeurs.php
Publié le 6 juin 2022,Toujours au ralenti,L’achalandage dans les transports en commun tarde à retrouver ses niveaux prépandémiques,https://www.lapresse.ca/actualites/grand-montreal/2022-06-06/transport-en-commun/toujours-au-ralenti.php
Publié le 31 mai 2022,"BIXI doit reprendre le flambeau d’ici 2023, insiste l’opposition","L’opposition officielle à l’hôtel de ville de Montréal veut ramener les trottinettes électriques dans la métropole d’ici 2023, mais cette fois, avec BIXI. Le parti propose de mettre sur pied un service de location de trottinettes électriques avec ancrage en libre-service d’ici la prochaine saison, sans répéter « les erreurs » du passé.",https://www.lapresse.ca/actualites/grand-montreal/2022-05-31/trottinettes-electriques/bixi-doit-reprendre-le-flambeau-d-ici-2023-insiste-l-opposition.php
Publié le 30 mai 2022,Les pourparlers devraient bientôt « s’accélérer »,"Près d’un mois après le retrait de CDPQ Infra du Réseau express métropolitain (REM) de l’Est, laissant ce dernier sous le giron de Québec et de Montréal, les discussions concernant l’avenir du réseau de train léger pourraient bientôt « s’accélérer ». Le mode à privilégier – en souterrain, au sol ou en surélevé – sera débattu dans les prochaines semaines.",https://www.lapresse.ca/actualites/grand-montreal/2022-05-30/avenir-du-rem-de-l-est/les-pourparlers-devraient-bientot-s-accelerer.php
Publié le 27 mai 2022,"Des wagons qui roulent, pas des têtes…",Le gouvernement Legault cherche-t-il à reprendre le contrôle de la planification des transports collectifs dans la région de Montréal ?,https://www.lapresse.ca/debats/editoriaux/2022-05-27/des-wagons-qui-roulent-pas-des-tetes.php
Publié le 25 mai 2022,"« Gestion brusque » et « opacité » à l’ARTM, selon un rapport","L’Autorité régionale de transport métropolitain recourt à un « style de gestion brusque » et fait preuve d’une « opacité organisationnelle », selon un rapport dévastateur déposé mercredi à l’Assemblée nationale. Québec souhaite modifier la loi sur l’ARTM pour « recadrer » les activités du groupe.",https://www.lapresse.ca/actualites/grand-montreal/2022-05-25/transport-collectif/gestion-brusque-et-opacite-a-l-artm-selon-un-rapport.php
Publié le 16 mai 2022,L’ex-policier Alain Babineau « passe à un autre appel »,"Un an après son embauche, qui avait suscité la controverse au sein des patrouilleurs montréalais, l’ex-policier Alain Babineau n’est plus à l’emploi de la Commissaire à la lutte au racisme et aux discriminations systémiques de Montréal. Il déplore avoir été limité dans ses fonctions.",https://www.lapresse.ca/actualites/grand-montreal/2022-05-16/commissaire-a-la-lutte-contre-le-racisme/l-ex-policier-alain-babineau-passe-a-un-autre-appel.php
Publié le 16 mai 2022,Des contrats irréguliers pour la firme de la conjointe d’un employé,"Pour la troisième fois en moins d’un an, l’inspectrice générale de Montréal dénonce la mauvaise gestion des contrats à la Société de transports de Montréal (STM). Cette fois, ses enquêteurs ont trouvé des irrégularités dans trois contrats conclus avec un sous-traitant où travaillait la conjointe d’un chargé de projet de l’organisme public.",https://www.lapresse.ca/actualites/2022-05-16/rapport-sur-la-stm/des-contrats-irreguliers-pour-la-firme-de-la-conjointe-d-un-employe.php
Publié le 16 mai 2022,Letenda : des bus électriques pour l’hiver québécois,"Dans les dernières années, les villes qui ont promis de diminuer l’empreinte carbone de leurs services publics, y compris de leurs services de transport en commun, sont nombreuses. Letenda, jeune entreprise établie à Longueuil, travaille justement à concevoir une solution de rechange complètement électrique aux autobus hybrides ou diesel.",https://www.lapresse.ca/affaires/portfolio/2022-05-16/economie-verte/letenda-des-bus-electriques-pour-l-hiver-quebecois.php
Publié le 15 mai 2022,"La ligne rose est morte, vive la ligne rose !","Vous avez des questions sur nos éditoriaux ? Des interrogations sur les sujets chauds de l’actualité ? Chaque semaine, l’équipe éditoriale répond aux lecteurs de .",https://www.lapresse.ca/contexte/2022-05-15/l-edito-vous-repond/la-ligne-rose-est-morte-vive-la-ligne-rose.php
Publié le 13 mai 2022,Les transporteurs surveilleront de près le port du masque,"Avec la fin du masque obligatoire prévue samedi dans la majorité des lieux publics, de nombreux usagers pourraient oublier ou négliger de porter le couvre-visage dans le transport public. La Société de transport de Montréal (STM) et exo comptent lancer une « nouvelle offensive » auprès des usagers et préviennent qu’elles resserreront la surveillance.",https://www.lapresse.ca/actualites/covid-19/2022-05-13/transport-collectif/les-transporteurs-surveilleront-de-pres-le-port-du-masque.php
Publié le 8 mai 2022,Pour réussir le REM,"Personne ne va s’ennuyer de la Caisse de dépôt et placement du Québec dans le dossier du REM de l’Est, après qu’elle eut abandonné sa prétention de le construire « dans les temps et dans les budgets », comme elle le soutenait à l’époque où on lui a confié le REM de l’Ouest.",https://www.lapresse.ca/contexte/chroniques/2022-05-08/pour-reussir-le-rem.php
Publié le 6 mai 2022,Montréal annonce trois nouvelles voies réservées aux autobus,"Trois nouvelles voies réservées aux autobus verront bientôt le jour à Montréal, sur la rue Jarry Est, le boulevard Ray-Lawson et le chemin Queen-Mary. La voie réservée se trouvant sur la rue de la Commune, entre McGill et Mill, devra toutefois être retirée en raison de « modifications » aux parcours des lignes locales.",https://www.lapresse.ca/actualites/grand-montreal/2022-05-06/montreal-annonce-trois-nouvelles-voies-reservees-aux-autobus.php
Publié le 5 mai 2022,Valérie Plante devant la CCMM : « On a sauvé le projet »,"En prenant les rênes du REM de l’Est avec le gouvernement du Québec, la Ville de Montréal a « sauvé le projet », estime la mairesse de Montréal, Valérie Plante. De son côté, la Société de transport de Montréal (STM) indique être engagée dans un « sprint » pour livrer rapidement des résultats.",https://www.lapresse.ca/actualites/grand-montreal/2022-05-05/rem-de-l-est/valerie-plante-devant-la-ccmm-on-a-sauve-le-projet.php
Publié le 4 mai 2022,La STM réclame 147 000 $ aux responsables,La Société de transport de Montréal (STM) réclame 147 000 $ aux trois hommes qui ont vandalisé la verrière de Marcelle Ferron à la station de métro Champ-de-Mars en 2019.,https://www.lapresse.ca/actualites/grand-montreal/2022-05-04/verriere-de-marcelle-ferron-vandalisee/la-stm-reclame-147-000-aux-responsables.php
Publié le 3 mai 2022,Un incendie a causé un arrêt de service sur une grande partie du métro,Un incendie lié à un problème électrique dans un local de la station Lionel-Groulx a causé un arrêt de service sur trois lignes du réseau de métro de la STM mardi après-midi.,https://www.lapresse.ca/actualites/grand-montreal/2022-05-03/un-incendie-a-cause-un-arret-de-service-sur-une-grande-partie-du-metro.php
Publié le 3 mai 2022,"Embarquement avant 2040, SVP !","C’était écrit dans le ciel que le REM de l’Est, dans sa dernière mouture, était condamné.",https://www.lapresse.ca/debats/editoriaux/2022-05-03/rem-de-l-est/embarquement-avant-2040-svp.php
Publié le 3 mai 2022,Le REM volait trop haut,"À la veille de la campagne électorale, François Legault sort sa gomme à effacer et enlève un nom de plus de sa liste d’ennemis.",https://www.lapresse.ca/actualites/chroniques/2022-05-03/le-rem-volait-trop-haut.php
Publié le 2 mai 2022,"REM : l’erreur, l’horreur et l’honneur","Le projet du REM de l’Est sera passé par toutes les étapes et toutes les émotions avant d’aboutir, lundi, à un projet repensé et qui fera honneur à Montréal et au Québec tout entier.",https://www.lapresse.ca/debats/chroniques/2022-05-02/rem-l-erreur-l-horreur-et-l-honneur.php
Publié le 2 mai 2022,Québec et Montréal reprennent le flambeau,"Abandon du tracé du centre-ville, nouvelle connexion avec la ligne verte, prolongements potentiels vers Laval et Lanaudière ; le REM de l’Est change complètement de direction. Jugeant que le projet « manque d’acceptabilité sociale », Québec et Montréal ont confirmé lundi en « prendre le leadership ». La filiale de la Caisse de dépôt CDPQ Infra est donc exclue du processus. La nouvelle formule plaît aux experts, mais ceux-ci espèrent voir des avancées concrètes rapidement.",https://www.lapresse.ca/actualites/grand-montreal/2022-05-02/rem-de-l-est/quebec-et-montreal-reprennent-le-flambeau.php
Publié le 2 mai 2022,Québec reprend le contrôle du REM de l’Est,"Cible de nombreuses critiques, le REM de l’Est tel que conçu par la Caisse de dépôt et placement est mis sur une voie de garage. Le gouvernement Legault prend le projet en main en vue de présenter une version plus acceptable.",https://www.lapresse.ca/actualites/grand-montreal/2022-05-02/quebec-reprend-le-controle-du-rem-de-l-est.php
Publié le 28 avr. 2022,"L’ARTM dévoile ses tarifs « métropolitains », indexés à 2 %","Les tarifs du transport collectif augmenteront de 2 % cette année dans le Grand Montréal, malgré la tendance inflationniste. Dès le 1er juillet, il faudra aussi oublier les titres de transport par villes, pour faire place aux titres « métropolitains ». Tout usager déboursera ainsi entre 94 $ et 255 $ mensuellement pour se déplacer à travers le réseau, en fonction du nombre de zones empruntées quotidiennement.",https://www.lapresse.ca/actualites/grand-montreal/2022-04-28/transport-collectif/l-artm-devoile-ses-tarifs-metropolitains-indexes-a-2.php
Publié le 27 avr. 2022,Changement à la présidence de l’ARTM,"(Québec) Quelques mois après avoir fait de sévères reproches à l’Autorité régionale de transport métropolitain (ARTM), le gouvernement Legault nomme un nouveau président à la tête de son conseil d’administration. L’ex-directeur général de la Ville de Longueuil, Patrick Savard, remplace Pierre Shedleur.",https://www.lapresse.ca/actualites/2022-04-27/changement-a-la-presidence-de-l-artm.php
Publié le 26 avr. 2022,"Le métro accueillera les chiens, mais n’aura pas de portes palières","D’ici la fin de l’année, les chiens en laisse seront acceptés dans le métro de Montréal dans le cadre d’un projet-pilote. Par contre, la Société de transport de Montréal (STM) abandonne le projet d’installation de portes palières, dites « antisuicides », sur les quais du métro, en raison des difficultés financières causées par la pandémie.",https://www.lapresse.ca/actualites/grand-montreal/2022-04-26/montreal/le-metro-accueillera-les-chiens-mais-n-aura-pas-de-portes-palieres.php
Publié le 21 avr. 2022,"Le transport adapté en péril, craint l’industrie",La pénurie de main-d’œuvre et la hausse des coûts d’exploitation font en sorte que l’offre de transport adapté pourrait devenir insuffisante à Montréal face à une demande en croissance. L’industrie demande l’intervention de la Ville et du gouvernement du Québec pour éviter que des usagers vulnérables ne se retrouvent sans moyen de transport.,https://www.lapresse.ca/actualites/2022-04-21/montreal/le-transport-adapte-en-peril-craint-l-industrie.php
Publié le 19 avr. 2022,La STM cherche des entreprises qualifiées pour utiliser un tunnelier,"Un mois après la confirmation du budget pour le prolongement de la ligne bleue, la Société de transport de Montréal (STM) lance comme prévu son « avis de qualification » pour l’utilisation d’un tunnelier, afin de creuser le tunnel du métro qui reliera Anjou à Saint-Michel.",https://www.lapresse.ca/actualites/grand-montreal/2022-04-19/prolongement-de-la-ligne-bleue/la-stm-cherche-des-entreprises-qualifiees-pour-utiliser-un-tunnelier.php
Publié le 19 avr. 2022,Le REM et les gouvernements de proximité,L’auteur s’adresse aux mairesses et maires de la Communauté métropolitaine de Montréal,https://www.lapresse.ca/debats/opinions/2022-04-19/le-rem-et-les-gouvernements-de-proximite.php
Publié le 16 avr. 2022,"R, comme dans « escalieR »","Un haut clocher pour le petit « n ». La grande roue pour le gros O. Un beau Q au-dessus de la fenêtre. Un Stade olympique qui s’élève en X et assez d’escaliers pour dessiner au moins huit lettres stylisées. Pour un projet aussi didactique que graphique, des étudiantes de l’UQAM ont trouvé dans la ville l’inspiration pour créer une police de caractères tout à fait montréalaise.",https://www.lapresse.ca/actualites/grand-montreal/2022-04-16/police-d-ecriture-montrealaise/r-comme-dans-escalier.php
Publié le 13 avr. 2022,Non aux chiens dans les transports en commun,"La majorité des lecteurs qui ont répondu à l’appel à tous de La Presse, mardi, sur la possibilité d’accepter les chiens dans les transports en commun se sont prononcés contre ce changement, qui est étudié par la Société de transport de Montréal (STM). Près des trois quarts des quelque 300 répondants ne veulent pas d’animaux dans les autobus et dans le métro, comme le propose le parti Ensemble Montréal. Voici un échantillon des réponses.",https://www.lapresse.ca/actualites/2022-04-13/place-aux-lecteurs/non-aux-chiens-dans-les-transports-en-commun.php
Publié le 12 avr. 2022,Une grosse commande financée par Québec,"Une promesse formulée par Québec il y a environ cinq mois prendra forme, ce mardi, avec le financement d’un appel d’offres milliardaire pour acquérir jusqu’à 1230 autobus urbains électriques. Cette commande s’accompagne d’une exigence de contenu local, mais devrait donner l’occasion aux constructeurs de l’extérieur de la province de soumettre une offre.",https://www.lapresse.ca/affaires/2022-04-12/autobus-urbains-electriques/une-grosse-commande-financee-par-quebec.php
Publié le 11 avr. 2022,"La STM réclame 4,5 millions à Bell Canada","La Société de transport de Montréal (STM) réclame 4,5 millions à Bell Canada et à une autre entreprise œuvrant en transformation numérique pour l’implantation ratée d’un progiciel de gestion des ressources humaines. L’opérateur leur reproche notamment d’avoir fait des déclarations « fausses, inexactes et trompeuses ».",https://www.lapresse.ca/actualites/2022-04-11/declarations-trompeuses/la-stm-reclame-4-5-millions-a-bell-canada.php
Publié le 11 avr. 2022,Montréal envisage d’accepter les chiens dans les transports en commun,Les chiens devraient-ils pouvoir prendre le métro et l’autobus à Montréal ?,https://www.lapresse.ca/actualites/grand-montreal/2022-04-11/montreal-envisage-d-accepter-les-chiens-dans-les-transports-en-commun.php
Publié le 10 avr. 2022,La timide qui a conquis la télévision,"Cette place lui revenait ! Fort heureusement, ses patrons ont vu les choses ainsi. Il y a un mois, Claudine Bourbonnais a été nommée cheffe d’antenne du de Radio-Canada. Que sait-on de cette femme qui entre chez nous depuis plus de 30 ans pour nous livrer l’actualité du jour ? Pas grand-chose. Il n’en fallait pas plus pour que je lui propose de prendre un latte en la bombardant de questions. Un exercice difficile pour elle.",https://www.lapresse.ca/contexte/2022-04-10/un-cafe-avec-claudine-bourbonnais/la-timide-qui-a-conquis-la-television.php
